,author,title,url,description,date,content
67,Monique Lima,"Entre balões de K-pop e de fezes, tensão aumenta entre as duas Coreias",https://www.infomoney.com.br/mundo/entre-baloes-de-k-pop-e-de-fezes-tensao-aumenta-entre-as-duas-coreias/,"Ambos os países afirmaram que não vão mais seguir o pacto de não-agressão assinado em 2018
The post Entre balões de K-pop e de fezes, tensão aumenta entre as duas Coreias  appeared first on InfoMoney.",2024-06-11T16:47:23Z,"Publicidade De um lado, um alto-falante gigante tocando músicas do grupo de k-pop BTS. Do outro, balões carregando esterco, bitucas de cigarro e lixo eletrônico. A guerra psicológica entre as Coreias do Norte e do Sul pode parecer esquete de programa de humor, mas especialistas temem que as tensões aumentem a ponto de desencadear um novo conflito entre os países. “Neste momento, ambas as Coreias tentam dissuadir uma à outra com ações politicamente simbólicas. O problema é que nenhum dos lados quer ser visto recuando, e as tensões na fronteira podem escalar para um conflito não intencional”, diz Leif-Eric Easley, professor da Universidade Ewha, à agência de notícias AP. As hostilidades começaram com civis jogando pen drives com sucessos do k-pop, doramas (obra audiovisual de ficção em formato de série, produzida no leste e sudeste da Ásia) e panfletos contra Kim Jong-un dentro da fronteira da Coreia do Norte. No último domingo (9), o próprio governo da Coreia do Sul resolveu reposicionar seus alto-falantes na fronteira para transmitir propaganda contra o vizinho. Continua depois da publicidade Segundo a AP, as transmissões incluíram hits da banda BTS, como “Butter” e “Dynamite”, além de notícias sobre a Samsung – maior empresa sul-coreana – e críticas ao programa de mísseis da Coreia do Norte. O governo sul-coreano confirmou que se tratava de uma retaliação às centenas de balões com lixo que chegaram pela fronteira do norte. A Defesa da Coreia do Norte confirmou que 15 toneladas de rejeitos foram enviadas ao país vizinho para dar uma amostra de como é “desagradável” lidar com o “lixo” do outro país. Segundo a Coreia do Sul, o país do norte também reinstalou seus próprios alto-falantes de propaganda perto da fronteira, mas até a manhã desta terça-feira (11) não os ligou. Continua depois da publicidade Há preocupações de que a guerra psicológica entre as Coreias esteja aumentando os riscos de confrontos militares entre os países, que já deixaram claro que não seguem mais o acordo de redução das tensões assinado em 2018. Diversifique investindo no Brasil e no exterior usando o mesmo App com o Investimento Global XP A relação diplomática entre os dois países tem piorado a ponto de a Coreia do Sul se aliar com os Estados Unidos para avaliar uma resposta à ameaça nuclear da Coreia do Norte. Continua depois da publicidade Easley afirmou à AP que o “autoproclamado” status nuclear de Kim Jong-un é um trunfo para o país do norte, que lhe dá “excesso de confiança em sua capacidade de coagir”. Além disso, o professor acredita que a Coreia do Sul “tem mais a perder no caso de um confronto físico”, mesmo que tenha mais informações e capacidades militares pelo apoio de aliados. No domingo (9), militares do Sul afirmaram que dispararam tiros de advertência depois que alguns soldados do Norte atravessaram a fronteira, segundo a agência de notícias sul-coreana Yonhap. Até o momento, a violação de território foi considerada não intencional, já que a região da Zona Desmilitarizada entre os países possui floresta densa, o que dificulta a identificação da linha da fronteira. Entretanto, o porta-voz do exército sul-coreano afirmou que o país está pronto para retaliações imediatas e fortes, se forem atacados. Continua depois da publicidade As duas Coreias estão tecnicamente em guerra, já que o confronto da década de 1950 entre os países se encerrou com um armistício, não um tratado de paz. O acordo de 2018 pretendia reduzir as tensões na península e evitar uma escalada militar, principalmente ao longo da fronteira."
68,Monique Lima,Iraque mata líder do Estado Islâmico em ação na Síria,https://www.infomoney.com.br/mundo/iraque-mata-lider-do-estado-islamico-em-acao-na-siria/,"Ação fez parte da coligação anti-Estado Islâmico liderada pelos EUA, com apoio do Iraque e Síria 
The post Iraque mata líder do Estado Islâmico em ação na Síria appeared first on InfoMoney.",2024-06-11T16:05:50Z,"Publicidade As forças de segurança do Iraque mataram na Síria um membro importante do grupo Estado Islâmico, responsável pela realização de ataques contra as forças do governo iraquiano, informou o Serviço de Segurança Nacional Iraquiano nesta terça-feira (11). Abu Zainab, um cidadão do Iraque, foi morto na cidade síria de Raqqa “durante os últimos dias”, em cooperação com as forças da coligação liderada pelos EUA, afirmou o serviço em comunicado. Um porta-voz da coligação anti-Estado Islâmico liderada pelos EUA não respondeu a um pedido de comentários. Continua depois da publicidade A coligação liderada pelos EUA está trabalhando com as forças de segurança iraquianas e as Forças Democráticas Sírias, lideradas pelos curdos, contra os remanescentes do grupo Estado Islâmico. No Iraque, o grupo foi derrotado em 2017, mas seus militantes ainda realizam ataques regulares à polícia, ao exército e às unidades paramilitares estatais iraquianas."
69,Fábio Matos,"Pré-candidato do PSDB, Datena tem até dia 30 para deixar programa na TV Bandeirantes",https://www.infomoney.com.br/politica/pre-candidato-do-psdb-datena-tem-ate-dia-30-para-deixar-programa-na-tv-bandeirantes/,"PSDB marcou para quinta-feira (13) o lançamento da pré-candidatura de Datena a prefeito de São Paulo; evento tucano acontecerá a partir das 10h30, no Novotel Jaraguá, no centro da capital paulista; saiba como será
The post Pré-candidato do PSDB, Datena tem at…",2024-06-11T17:19:55Z,"Publicidade Prestes a ser lançado oficialmente como pré-candidato do PSDB à prefeitura de São Paulo (SP), o apresentador de TV José Luiz Datena terá poucos dias para, enfim, sacramentar a decisão de concorrer ou não à sucessão do prefeito Ricardo Nunes (MDB) na maior cidade do Brasil. De acordo com a legislação eleitoral, Datena só poderá continuar à frente do programa Brasil Urgente, que apresenta na TV Bandeirantes, até o dia 29 de junho (que cai em um sábado). A partir do dia 30 de junho (domingo), caso decida mesmo disputar a eleição, o jornalista terá de abandonar o programa (leia aqui todas as regras da Justiça Eleitoral). Baixe uma lista de 11 ações de Small Caps que, na opinião dos especialistas, possuem potencial de crescimento para os próximos meses e anos Continua depois da publicidade O Brasil Urgente é um telejornal policial, com viés bastante popular, exibido pela Band de segunda a sábado, das 16h às 19h20.  Ainda de acordo com o Tribunal Superior Eleitoral (TSE), as convenções partidárias que vão definir as candidaturas para as eleições de 2024 devem ocorrer entre os dias 20 de julho e 5 de agosto. Definidos os candidatos, os partidos terão até 15 de agosto para registrar os nomes na Justiça Eleitoral. O PSDB marcou para quinta-feira (13) o lançamento da pré-candidatura de Datena a prefeito de São Paulo. O evento tucano acontecerá a partir das 10h30, no Novotel Jaraguá, no centro da capital paulista, e reunirá algumas das principais lideranças do partido. Continua depois da publicidade São esperadas as presenças do presidente nacional do PSDB, Marconi Perillo (GO), e do deputado federal Aécio Neves (MG), que disputou a Presidência da República nas eleições de 2014. O presidente do diretório municipal do PSDB em São Paulo, José Aníbal, também comparecerá, assim como o prefeito de Ribeirão Preto, Duarte Nogueira (PSDB), que comanda a federação PSDB-Cidadania no estado de São Paulo. Datena deve fazer um discurso de agradecimento ao partido e pretende colocar seu nome à disposição da legenda para liderar a chapa tucana à prefeitura da capital. Continua depois da publicidade Desde que foi fundado, em 1988, o PSDB sempre teve candidato próprio nas eleições municipais em São Paulo. A legenda elegeu três prefeitos: José Serra (em 2004), João Doria (2016) e Bruno Covas (2020). Ricardo Nunes, o atual prefeito, era vice de Covas e assumiu a prefeitura com a morte do tucano, em 2021.  O deputado estadual e apresentador de TV Mauro Tramonte (Republicanos) aparece em primeiro lugar nas intenções de voto e venceria todos os adversários no segundo turno, mostra pesquisa da Quaest Datena vinha sendo cotado para ocupar a vaga de candidato a vice na chapa liderada pela deputada federal Tabata Amaral (SP), pré-candidata do PSB à prefeitura da capital paulista. Em abril, apenas 4 meses depois de se filiar ao PSB, Datena migrou para o PSDB, em um acordo que supostamente atrairia os tucanos para a chapa da parlamentar. Apesar das especulações de que poderia ser vice de Tabata, Datena nunca assumiu, publicamente, a pré-candidatura. Desde que trocou de partido, o apresentador vinha sendo pressionado por nomes como Aécio, Perillo e o governador do Rio Grande do Sul, Eduardo Leite (PSDB), a liderar a chapa tucana na maior cidade do Brasil. Continua depois da publicidade O presidente do diretório paulistano do PSDB, o ex-senador José Aníbal (SP), é um dos nomes ventilados para ser candidato a vice em uma possível chapa “puro sangue” liderada por Datena. Outra hipótese seria tentar convencer Tabata a desistir de sua candidatura e ser vice do apresentador – mas essa possibilidade é considerada quase nula, segundo dirigentes do PSB. Em entrevista ao InfoMoney, em abril, Aníbal já afirmava que o PSDB queria “recuperar seu protagonismo” nas eleições municipais. “Não podemos deixar que usem nossa legenda para negociar acordos políticos aqui ou ali e não termos protagonismo no processo. Temos de falar, nos posicionar e dizer o que o partido pensa que seria importante para a cidade de São Paulo”, afirmou. O apresentador da TV Bandeirantes já passou por 10 partidos em sua trajetória política, embora jamais tenha se candidatado a nenhum cargo. Antes de trocar o PSB pelo PSDB, Datena já fez parte de PT, PP, PRP, DEM, MDB, PSL, PSD, União Brasil e PSC – em uma verdadeira “montanha-russa” partidária. Continua depois da publicidade Leia também: Nas eleições municipais de 2020, Datena esteve muito próximo de ser companheiro de chapa do então prefeito Bruno Covas (PSDB), que buscava renovar o mandato. Então filiado ao MDB, ele teve uma série de conversas com Covas, que se animava com a possibilidade de ter o apresentador como vice. Na reta final, Datena – autor de bordões que se tornaram icônicos na TV como “quero ‘ibagens’”, “põe na tela”, “é só nosso” e “me ajuda aí, pô” – recuou mais uma vez, alegando que a TV Bandeirantes havia lhe pedido para permanecer na emissora. O candidato a vice na chapa foi Ricardo Nunes (MDB), que acabaria assumindo a prefeitura após a morte de Covas, em 2021, e agora tenta a reeleição. Ao se filiar ao PSDB, Datena relembrou o episódio e disse que errou ao não ter aceitado o convite de Covas. “Eu deixei de ser vice-prefeito dele e acho que foi a pior coisa que eu fiz. Acabou caindo no colo do atual prefeito, que transformou São Paulo no que eu vi vindo para cá hoje”, disse. A vida político-partidária de Datena teve início no Partido dos Trabalhadores, de Luiz Inácio Lula da Silva. O jornalista foi filiado ao PT durante 23 anos, entre 1992 e 2015, e sempre se regozijou publicamente pela amizade que dizia nutrir por Lula. As denúncias de corrupção que abalaram o PT, especialmente a partir da eclosão da Operação Lava Jato e do escândalo do “petrolão”, afastaram Datena dos petistas. Durante o governo de Jair Bolsonaro (PL), ele se aproximou do então presidente da República – que entrevistou algumas vezes e com quem mantinha encontros regulares, inclusive no Palácio do Planalto. Em 2022, quando estava no PSC, Datena foi cogitado novamente como candidato ao Senado, possivelmente com o apoio de Bolsonaro e do então candidato ao governo de São Paulo, Tarcísio de Freitas (Republicanos) – hoje governador do estado. Bolsonaro chegou a dizer que havia “fechado com o Datena”, porém, horas depois dessa declaração, o apresentador agradeceu pelo apoio, mas desistiu da disputa. O vaivém de Datena na política também o aproximou de nomes como o deputado federal Guilherme Boulos (PSOL), pré-candidato à prefeitura de São Paulo, e o ex-governador do Ceará e ex-ministro Ciro Gomes (PDT). Em abril do ano passado, Datena apareceu em um vídeo ao lado de Boulos, em que conversavam sobre o cenário eleitoral na capital paulista. “Se você peitar o PT e nós sairmos candidatos, se você falar para o Lula ‘eu quero o Datena como vice e sinto muito’, nós podemos sair”, disse o jornalista, na gravação. Após o vazamento do vídeo, Datena negou que tenha pedido para ser vice de Boulos. Em 2022, o apresentador também foi especulado como vice da chapa de Ciro Gomes à Presidência da República. Os dois se reuniram para tratar do assunto, mas as conversas não foram adiante. Por fim, José Luiz Datena já declarou apoio, em 2021, ao ex-governador de São Paulo João Doria (na época, no PSDB) para a Presidência da República. O jornalista foi apresentado como pré-candidato a senador pelo União Brasil, com o apoio dos tucanos paulistas, mas desistiu da disputa após Doria retirar sua candidatura presidencial por não ter obtido apoio interno na legenda. “Doria fez o movimento errado de novo. Ele deixa de ser o traído pelo PSDB e trai o Rodrigo Garcia. Por consequência, eu não tenho mais nenhum compromisso com essa chapa”, afirmou Datena na ocasião. Na filiação ao PSDB, o 11º partido em sua biografia, Datena se disse honrado e feliz com a nova oportunidade na política, mas não foi assertivo ao comentar a possibilidade de se candidatar em outubro. “O futuro a Deus pertence. Por que eu ia convidar a Tabata para vir aqui se eu penso de forma diferente? Mas não depende só de nós”, afirmou. “Os partidos estão conversando. Precisa perguntar mais para os dirigentes dos partidos. Eles que respondam.”"
70,Monique Lima,FII MXRF11 quer captar R$ 800 milhões na maior oferta já anunciada pelo fundo,https://www.infomoney.com.br/onde-investir/fii-mxrf11-quer-captar-r-800-milhoes-na-maior-oferta-ja-realizada-pelo-fundo/,"O valor unitário dos novos papéis foi fixado em R$ 9,74, com direito de preferência dos cotistas iniciado em 13 de junho
The post FII MXRF11 quer captar R$ 800 milhões na maior oferta já anunciada pelo fundo appeared first on InfoMoney.",2024-06-11T18:48:20Z,"Publicidade O FII Maxi Renda (MXRF11) aprovou a realização da décima emissão de cotas do fundo e pretende captar R$ 800 milhões com a oferta. Se conseguir alcançar o montante previsto, será a maior captação da história do Maxi Renda. Descubra o passo a passo para viver de renda e receber seu primeiro aluguel na conta nas próximas semanas, sem precisar ter um imóvel Segundo o comunicado, o valor unitário dos novos papéis foi fixado em R$ 9,74 e a taxa de distribuição será de R$ 0,33 – totalizando um preço de subscrição de R$ 10,07. Continua depois da publicidade Na manhã desta terça-feira (11), as cotas do MXRF11 eram negociadas a R$ 10,18 na B3. O valor patrimonial do fundo atualmente – espécie de valor justo – é de R$ 9,84 por cota. Cotistas com posição no final da sessão do dia 13 de junho terão direito de preferência na oferta, que poderá ser exercido entre os dias 17 de junho e 25 de junho de 2024. De acordo com a gestão da carteira, o recurso obtido na oferta será usado para adquirir ativos financeiros permitidos pela regulamentação do fundo, com objetivo de “proporcionar os cotistas a valorização de suas cotas”. Continua depois da publicidade Leia também:  Considerando as cotas adicionais, a oferta do MXRF11 pode movimentar R$ 1 bilhão, de acordo com dados da Comissão de Valores Mobiliários (CVM). Em janeiro deste ano, o MXRF11 superou a marca de um milhão de cotistas, se consolidando como o fundo imobiliário mais popular do mercado brasileiro. De perfil híbrido, que investe em múltiplas classes de ativos, o Maxi Renda tem patrimônio líquido de R$ 3,294 bilhões e está em operação desde abril de 2012. Continua depois da publicidade O portfólio do fundo é composto por certificados de recebíveis imobiliários (71%), cotas de outros FIIs (13%), permutas financeiras (5%) e caixa (11%). Os dados fazem parte do último relatório gerencial, divulgado pela carteira em maio."
71,Roberto de Lira,Mudanças internas na França e Alemanha importam mais que as do Parlamento Europeu,https://www.infomoney.com.br/mundo/mudancas-internas-na-franca-e-alemanha-importam-mais-que-as-do-parlamento-europeu/,"Perda de apoio tanto de Emmanuel Macron como de Olaf Scholz pode fortalecer posições nacionalistas sobre as do bloco econômico, na avaliação de especialista
The post Mudanças internas na França e Alemanha importam mais que as do Parlamento Europeu appeared fi…",2024-06-11T18:45:53Z,"Publicidade Embora os resultados das eleições para o Parlamento Europeu tenham mostrado um avanço dos partidos mais à direita, a configuração final das cadeiras do centro de decisão da UE pode  ficar relativamente estável em relação à atual composição.  Mas o impacto das mudanças da opinião pública dentro dos países – especialmente na França e na Alemanha, as duas maiores economias do bloco – pode dificultar e até mudar a orientação atual. A avaliação foi feita em artigo para o think tank Bruegel assinado por Maria Demertzis, professora de Política Econômica na Escola de Governança Transnacional de Florença.  Continua depois da publicidade   Ela classifica os resultados das eleições europeias como “um saco misto”: Partido Popular Europeu e os Social-Democratas, tradicionalmente os maiores partidos do bloco, mantiveram as respectivas primeira e segunda posições no Parlamento Europeu. Mas o Renew Europe (o partido dos liberais) e os Verdes tiveram perdas substanciais. O grupo de extrema-direita Identidade e Democracia (ID) conquistou 9 lugares em comparação com as eleições europeias de 2019, mas a acadêmica afirma que isso está muito longe de ser um divisor de águas. Continua depois da publicidade Um dos motivos é que há 53 novos membros eleitos que ainda não declararam qual grupo (se houver) gostariam de se filiar, e mais mudanças podem acontecer entre outros grupos menores. “Globalmente, houve uma pequena viragem para a direita, mas a perspectiva do Parlamento Europeu não mudou de forma significativa”, analisa. Mas ela alerta que, embora o temor de que a extrema-direita obtivesse ganhos significativos dentro da União Europeia não tenha se materializado, o cenário político da UE mudou, devido ao que aconteceu na Alemanha e na França. O partido de centro-esquerda Social-Democrata (SDP), de Olaf Scholz, perdeu muito, ficando em terceiro lugar, atrás dos democratas-cristãos (CDU/CSU) e da extrema-direita Alternativa para a Alemanha (AfD). “Essa votação poderia sinalizar uma falta de confiança do eleitorado no PSD de Scholz e poderia enfraquecer seriamente o governo pelo restante de seu mandato”, explica. Continua depois da publicidade No contexto da UE, o atual governo não poderá defender posições, a menos que sejam amplas e apartidárias. “É importante ressaltar que o que esses resultados eleitorais nos mostram é que, 35 anos após a reunificação, a Alemanha ainda opera como se fossem dois países diferentes”, cita a professora. A parte ocidental da Alemanha votou no CDU/CSU e o Leste votou na AfD e a incapacidade de alcançar a coesão em nível interno, apesar de políticas específicas, não é um sinal de esperança para a coesão europeia, frisa Maria Demertzis. Na França, a decisão do presidente Emmanuel Macron de dissolver a Assembleia Nacional foi um o verdadeiro choque após as eleições da EU, conforme argumentação da professora. Depois de a sua coligação ter ficado em segundo lugar, com menos de metade dos votos do partido de extrema-direita francês, o Reunião Nacional (RN), Macron marcou novas eleições legislativas nacionais para o final deste mês. Continua depois da publicidade A vitória do RN pode muito bem repetir-se no início de julho e o líder do partido, Jordan Bardella, poderia se tornar o primeiro-ministro mais jovem da França, aos 28 anos, colocando-o em coabitação com o presidente Macron. Macron pode optar por renunciar, não aceitando cogovernar com a extrema-direita, ou pode permanecer com o governo dividido. E aí será necessário observado as agências de rating, uma vez que os títulos soberanos franceses tiveram um rebaixamento há poucos dias por conta da dívida fiscal. “As agências de classificação de risco tentarão impor disciplina à França, um efeito preocupante para qualquer líder que sinta que tem a liberdade de gastar com o voto popular”, prevê. Continua depois da publicidade Para ela, ao marcar novas eleições após constatar sua perda de apoio, Macron espera que mais pessoas votem e que, chocadas com a perspectiva de um primeiro-ministro de extrema-direita, vão decidir com mais “prudência”. “Uma coisa é certa: o presidente Macron está desesperado e, neste jogo de pôquer, jogou todas as cartas na mesa. O ataque é agora a sua melhor defesa.” O artigo defende que, apesar do resultado mais ou menos estável para o Parlamento Europeu, estas eleições demonstram mais uma vez que não existe uma história única na UE. Disputam-se, ganham-se e perdem-se eleições em questões nacionais que podem tirar a UE do rumo. Ou seja, se o presidente Macron perder sua aposta eleitoral, a extrema direita na França pode tentar enfraquecer a UE e minar sua posição global dentro do bloco. A Alemanha, onde o governo também foi enfraquecido, pode não ser capaz de unir todos em torno de suas posições para repelir a extrema-direita. Mas Macron vencer a aposta, continuará pressionando para moldar posições na França e em Bruxelas. “O resultado das eleições parlamentares francesas é crucial, especialmente numa altura em que a UE provavelmente prosseguirá com políticas industriais para fazer face aos desafios globais provenientes tanto dos Estados Unidos como da China. O que não é claro é se estas políticas servirão os interesses franceses em detrimento do mercado único da UE e, em última análise, do consumidor europeu.” O texto finaliza lembrando que o que pode se tornar o resultado das eleições europeias menos polêmico é a recondução de Ursula Von der Leyen como presidente da Comissão Europeia. “Com os números a seu favor, e Paris e Berlim distraídas por seus próprios problemas internos, sua recondução pode ser mais certa do que se pensava.”"
72,Gabriel,Pai do Brexit e ícone fashion promovem eventos para Trump e Biden em Londres,https://www.infomoney.com.br/mundo/wintour-x-farage-estrelas-britanicas-promovem-eventos-para-biden-e-trump-em-londres/,"A ideia é reunir expatriados americanos endinheirados para conseguir aumentar o volume de doações das campanhas
The post Pai do Brexit e ícone fashion promovem eventos para Trump e Biden em Londres appeared first on InfoMoney.",2024-06-11T18:53:11Z,"Publicidade Nigel Farage, líder do Brexit e da extrema-direita britânica, e Anna Wintour, ícone fashion e editora da revista Vogue, vão promover em Londres eventos de arrecadação de fundos para as campanhas de Donald Trump e Joe Biden nesta quarta. Donald Trump Jr será o principal convidado do evento republicano, organizado por Holly Valance, uma atriz de novelas australianas que se transformou em ativista política conservadora. Farage, também em campanha nas eleições britânicas, será uma das “estrelas” do encontro. A ideia é reunir expatriados americanos endinheirados para conseguir aumentar o volume de doações de Trump, que ainda está atrás do rival democrata nos fundos para campanha. Além disso, o ex-presidente busca fundos para fin Continua depois da publicidade No mesmo dia, Anne Wintour vai fazer um evento em busca de doações para a campanha de Biden. A editora da Vogue, que apoiou Biden na campanha de 2020, já fez um evento do tipo na França, durante a semana de moda de Paris. Os convites para o evento dos Republicanos vão custar US$ 100 mil. Apenas cidadãos norte-americanos poderão fazer doações para campanha de Trump. Segundo o jornal Financial Times, o evento já arrecadou US$ 2 milhões em vendas de convites e doações. Segundo os organizadores, o valor já é um recorde para eventos do tipo no Reino Unido."
