,author,title,url,description,date,content
56,Roberto de Lira,Senado da Argentina pode votar Lei de Bases de Javier Milei hoje,https://www.infomoney.com.br/mundo/senado-da-argentina-abriu-o-debate-e-pode-votar-lei-de-bases-de-milei-hoje/,"Governo atenuou o texto para atender aos pedidos de senadores mais favoráveis à aprovação; milhares de manifestantes estão reunidos nas proximidades da Praça do Congresso para pressionar contra as medidas
The post Senado da Argentina pode votar Lei de Bases d…",2024-06-12T16:52:30Z,"Publicidade O governo de Javier Milei tenta nesta quarta-feira (12) sua jogada mais importante desde que o presidente libertário assumiu o poder, há seis meses: o projeto da Lei da Bases, uma ampla lista de medidas reformistas de desregulamentação econômica está em discussão e deve ser votado pelo Senado nas próximas horas. Enquanto o governo atenuou o texto para atender aos pedidos de senadores mais favoráveis à aprovação, milhares de manifestantes estão reunidos nas proximidades da Praça do Congresso, em frente ao parlamento, para pressionar contra as medidas. A tropa governista negociou com a chamada oposição pró-diálogo e concordou em eliminar do texto o capítulo previdenciário da Lei de Bases que buscava acabar com o atual sistema de moratória e de aposentadoria por invalidez. Continua depois da publicidade Pela manhã, o governo libertário superou o primeiro desafio, que era conseguiu reunir 37 senadores necessários para obter quórum e abrir a discussão, mas contagens não oficiais mostra uma possibilidade de um empate de 36 a 36, o que levaria a um voto de definição da vice-presidente Victoria Villarruel. O senador radical Martín Lousteau, cujo voto foi crucial para o início dos debates, já avisou que votará contra a nova legislação."
57,Fábio Matos,PF mira PROS em operação sobre desvio de R$ 36 mi de fundos partidário e eleitoral,https://www.infomoney.com.br/politica/pf-mira-pros-em-operacao-sobre-desvio-de-r-36-mi-de-fundos-partidario-e-eleitoral/,"A Polícia Federal cumpre 7 mandados de prisão preventiva e 45 de busca e apreensão nos estados de São Paulo e Goiás, além do Distrito Federal; 6 pessoas já foram presas até o momento
The post PF mira PROS em operação sobre desvio de R$ 36 mi de fundos partidá…",2024-06-12T12:38:01Z,"Publicidade A Polícia Federal (PF) deflagrou, na manhã desta quarta-feira (12), uma operação para apurar desvios de recursos dos fundos partidário e eleitoral nas eleições de 2022. O principal alvo da operação é o Partido Republicano da Ordem Social (PROS), recentemente incorporado pelo Solidariedade. A corporação cumpre 7 mandados de prisão preventiva e 45 de busca e apreensão nos estados de São Paulo e Goiás, além do Distrito Federal. Segundo informações da TV Globo, 6 pessoas haviam sido presas até por volta das 8 horas. Continua depois da publicidade Baixe uma lista de 11 ações de Small Caps que, na opinião dos especialistas, possuem potencial de crescimento para os próximos meses e anos As investigações da PF tiveram início a partir de uma denúncia feita por um dirigente do partido a respeito de supostos desvios de cerca de R$ 36 milhões. A operação policial busca bloquear e indisponibilizar esse valor e mais 33 imóveis. De acordo com a PF, os suspeitos são investigados por crimes de organização criminosa, lavagem de dinheiro, furto qualificado, apropriação indébita, falsidade ideológica eleitoral e apropriação de recursos destinados ao financiamento eleitoral. Continua depois da publicidade Entre os alvos da operação, está o atual presidente nacional do Solidariedade, Eurípedes Gomes Júnior. Além dele, aparecem: Os mandados cumpridos pela PF foram autorizados pela Justiça do Distrito Federal. Em nota, o Solidariedade afirma que os fatos investigados pela PF ocorreram antes da união da legenda com o PROS. Continua depois da publicidade “Esses são fatos ocorridos antes da união do PROS com o Solidariedade. Estamos tomando pé da situação e ainda não temos uma posição sobre os fatos”, informou o partido."
58,Monique Lima,Rússia amplia exercícios com armas nucleares táticas,https://www.infomoney.com.br/mundo/russia-amplia-exercicios-com-armas-nucleares-taticas/,"Vladimir Putin ordenou os exercícios após sinais de autoridades ocidentais para que a Ucrânia atacasse a Rússia com armas ocidentais
The post Rússia amplia exercícios com armas nucleares táticas appeared first on InfoMoney.",2024-06-12T13:48:06Z,"Publicidade A Rússia afirmou nesta quarta-feira (12) que soldados e marinheiros do distrito militar de Leningrado, no norte do país, que faz fronteira com os membros da Otan (Noruega, Finlândia, Polônia, Estônia, Letônia e Lituânia), participaram de exercícios para mobilizar armas nucleares táticas. A medida parece ampliar a geografia divulgada dos exercícios nucleares para incluir soldados de distritos militares que cobrem quase toda a fronteira europeia da Rússia, que se estende do Oceano Ártico até o Mar Negro. Diversifique investindo no Brasil e no exterior usando o mesmo App com o Investimento Global XP Continua depois da publicidade O presidente Vladimir Putin ordenou os exercícios, que foram anunciados no mês passado para serem realizados no distrito militar do sul, na fronteira com a Ucrânia, após o que a Rússia disse serem sinais vindos de autoridades ocidentais de que permitiriam que a Ucrânia atacasse profundamente a Rússia com armas ocidentais. “O pessoal da unidade de mísseis do Distrito Militar de Leningrado está praticando tarefas de treinamento de combate”, disse o Ministério da Defesa da Rússia em um comunicado sobre os exercícios. Essas tarefas incluíram a obtenção de munição especial de treinamento para o sistema de mísseis tático-operacional Iskander-M, equipando os veículos de lançamento com eles e avançando secretamente para a área de posição designada para os preparativos de lançamentos de mísseis, acrescentou. Continua depois da publicidade “As tripulações dos navios da marinha envolvidos no treinamento equiparão os mísseis de cruzeiro baseados no mar com ogivas simuladas especiais e entrarão nas áreas de patrulha designadas”, disse o ministério. Um vídeo divulgado pelo Ministério da Defesa russo mostrou um sistema de mísseis móveis sendo escoltado para um campo, bem como um foguete sendo carregado em um navio de guerra. A Rússia disse na terça-feira que iniciou um segundo estágio de exercícios para praticar a prontidão de armas nucleares táticas ao lado das tropas bielorrussas. Continua depois da publicidade Putin disse na sexta-feira que a Rússia não precisa usar armas nucleares para garantir a vitória na Ucrânia, o sinal mais forte do Kremlin até o momento de que o conflito mais mortal da Europa desde a Segunda Guerra Mundial não se transformará em uma guerra nuclear. Mas ele também declarou que não descartava mudanças na doutrina nuclear da Rússia, que estabelece as condições sob as quais essas armas poderiam ser usadas. Ele já havia dito anteriormente que não via motivos para mudar a doutrina."
59,leonardogstos,Onde investir na renda fixa em junho? Indexados à inflação dominam recomendações,https://www.infomoney.com.br/onde-investir/onde-investir-na-renda-fixa-em-junho-indexados-a-inflacao-dominam-recomendacoes/,"Confira os títulos públicos, debêntures, CRIs e CRAs recomendados por bancos para junho
The post Onde investir na renda fixa em junho? Indexados à inflação dominam recomendações appeared first on InfoMoney.",2024-06-12T14:00:00Z,"Publicidade É impossível analisar a renda fixa brasileira sem olhar para o juro real que os títulos públicos oferecem hoje. O retorno de mais de 6% acima da inflação é considerado atraente por qualquer analista. Não à toa, os títulos do Tesouro IPCA+ estão entre os mais indicados para investir em junho.  CDB Banco XP 150% do CDI Bruto. Invista até R$60 mil com segurança e liquidez diária Na carona dos títulos públicos, as recomendações de ativos de crédito privado são dominadas por papéis indexados ao IPCA. A lista de títulos de dívida de empresas não financeiras tem CRI pagando juro real de 8%.  Continua depois da publicidade Em relatório, Lucas Queiroz, estrategista de renda fixa para pessoa física do Itaú BBA, explica que a expectativa por juros mais altos nos Estados Unidos, alteração na meta fiscal do Brasil e preocupações com a mudança na presidência do Banco Central trazem pessimismo ao mercado financeiro.  “É inegável que passamos por uma expressiva deterioração nos últimos dois meses e o pessimismo refletido nos preços dos ativos domésticos não é injustificável’, diz o especialista.  Com isto, há algumas oportunidades no mercado de renda fixa atualmente.  Continua depois da publicidade Leia também: O pós-fixados, indexados à Selic, são os mais beneficiados pela mudança de expectativa. Com o mercado esperando juros mais altos por mais tempo, esses ativos devem pagar mais do que o esperado no início do ano.  No início de 2024, o Itaú BBA esperava rentabilidade acumulada entre 9,5% e 10% para os títulos do Tesouro Selic. Agora, com a mudança de cenário, a estimativa já passou para 11% no ano. Por isto, XP e Itaú colocaram em suas carteiras de renda fixa o Tesouro Selic 2027. Continua depois da publicidade Unanimidade nas carteiras de três grandes bancos, o Tesouro IPCA+ aparece em vários vencimentos. Relatório da XP diz que a casa acha importante “manter parcela de ativos atrelados à inflação para proteção contra seu efeito ao longo do tempo, especialmente considerando a imprevisibilidade em relação à sua trajetória em prazos mais longos”.  Até os prefixados, antes considerados muito arriscados, seguem com espaço na carteira dos analistas. “À medida que a inflação implícita sobe, os prefixados passam a ganhar atratividade e, neste momento, são uma combinação interessante com os pós-fixados”, diz Queiroz.  Confira as recomendações de XP, Santander e Itaú BBA para o investimento em títulos públicos em junho: Continua depois da publicidade Leia também:  Um dos destaques do mês é uma debênture da Origem Energia, recomendada por BTG Pactual e XP. O BTG pontua que, em menos de dois anos de operação, a empresa já expandiu sua produção em quase três vezes com baixos gastos e “riscos de desenvolvimento menores do que pares do setor”. O ativo é o único prefixado da lista, com taxa de 14,15% ao ano.  Entre os indexados ao IPCA, destaque para CRI da Cogna, que paga juro real de 8,07% ao ano até 2029. Um dos pontos positivos da estratégia da empresa é a redução de custos da operação, segundo o BTG. “A empresa compartilha custos entre os formatos presencial e EAD, permitindo que, mesmo nos cursos presenciais, mais de 30% das aulas sejam oferecidas remotamente”.  Continua depois da publicidade Confira as recomendações de XP e BTG Pactual para o investimento em renda fixa privada em junho:"
60,Roberto de Lira,Macron diz que não renunciará se sua coalizão perder eleição parlamentar antecipada,https://www.infomoney.com.br/mundo/macron-diz-que-nao-renunciara-se-sua-coalizao-perder-eleicao-parlamentar-antecipada/,"Presidente da França disse a jornalistas que quer cortar esses rumores pela raiz; ele dissolveu o parlamento e convocou novas eleições pós ser derrotado pela direita no pleito europeu
The post Macron diz que não renunciará se sua coalizão perder eleição parla…",2024-06-12T13:18:00Z,"Publicidade Paris (Reuters) – O presidente da França, Emmanuel Macron, reafirmou nesta quarta-feira (12) que não renunciará ao cargo caso seu grupo político seja derrotado na eleição parlamentar antecipada convocada por ele. “Quero cortar essa ideia pela raiz, (a chance de isso acontecer) nunca existiu”, disse ele a jornalistas. Macron convocou a eleição antecipada no domingo, depois que a extrema-direita da França derrotou o partido governista na eleição para o Parlamento Europeu. Continua depois da publicidade Aliança contra a direita Na entrevista, Macron pediu aos partidos rivais de ambos os lados do espectro político que se juntem a ele na formação de uma aliança democrática contra o partido de extrema-direita Reunião Nacional (RN) na próxima eleição parlamentar. “Não quero dar as chaves do poder à extrema-direita em 2027, portanto, aceito plenamente o fato de ter desencadeado um movimento para prestar esclarecimentos”, disse ele, alegando que as políticas do RN empobrecerão os trabalhadores e os aposentados. Continua depois da publicidade Mesmo que o RN ganhe a maioria na votação marcada para 30 de junho e 7 de julho, Macron permanecerá presidente por mais três anos e ainda estará encarregado da defesa e da política externa. Mas ele perderá o controle sobre a agenda doméstica, incluindo política econômica, segurança, imigração e finanças. Ele conclamou “muitos de nossos compatriotas e líderes políticos que não se reconhecem na febre extremista” a “construir um novo projeto… uma coalizão para governar, uma coalizão para agir a serviço dos franceses e da República.” Macron se comprometeu a tomar uma atitude mais firme em questões de imigração, segurança e justiça, argumentando que uma extrema-esquerda propensa ao antissemitismo seria muito “frouxa”. As soluções da extrema-direita não resolveriam os problemas e apenas destruiriam o estado de direito constitucional da França, disse ele. Continua depois da publicidade Macron também criticou as negociações políticas dos últimos dias, dizendo que “a máscara caiu” de alguns partidos que buscam forjar “alianças não naturais”. O líder do partido conservador Os Republicanos, Eric Ciotti, que apelou para uma aliança eleitoral entre os candidatos de seu partido e o RN, fez “um acordo com o diabo”, afirmou Macron. O RN deve emergir como a ala mais forte após a eleição, mas pode ficar aquém de uma maioria absoluta, segundo uma pesquisa realizada nesta semana."
