,author,title,url,description,date,content
40,GlobeNewswire,IZEA Launches Flex Budget Suite for Enhanced Campaign Budget Management,https://financialpost.com/globe-newswire/izea-launches-flex-budget-suite-for-enhanced-campaign-budget-management,"New Tools Provide Additional Management and Financial Controls for Influencer Marketing Initiatives ORLANDO, Fla. , June 10, 2024 (GLOBE NEWSWIRE) — IZEA Worldwide, Inc. (NASDAQ: IZEA), the premier provider of technology, data, and services for the Creator Ec…",2024-06-10T14:04:27Z,Error: 403 Client Error: Forbidden for url: https://financialpost.com/globe-newswire/izea-launches-flex-budget-suite-for-enhanced-campaign-budget-management
41,Bloomberg News,Ukraine Recovery Official Abruptly Resigns Amid Infighting,https://financialpost.com/pmn/business-pmn/ukraine-recovery-official-abruptly-resigns-amid-infighting,Ukraine’s top official tasked with reconstruction abruptly resigned and accused the government of hindering his efforts after the nation’s premier blocked his request to attend a conference in Berlin.,2024-06-10T13:55:18Z,Error: 403 Client Error: Forbidden for url: https://financialpost.com/pmn/business-pmn/ukraine-recovery-official-abruptly-resigns-amid-infighting
42,Bloomberg News,Near Record Copper Prices Can’t Stop One Miner From Going Bust,https://financialpost.com/pmn/business-pmn/near-record-copper-prices-cant-stop-one-miner-from-going-bust,"Nevada Copper Corp., a miner backed by Pala Investments and Mercuria Energy Group Ltd., has filed for bankruptcy protection, even as prices of the metal sit near the highest on record.",2024-06-10T14:10:32Z,Error: 403 Client Error: Forbidden for url: https://financialpost.com/pmn/business-pmn/near-record-copper-prices-cant-stop-one-miner-from-going-bust
43,GlobeNewswire,Hong Kong Earns Two Entries on the Prestigious World’s 50 Best Restaurants List with Best Entry at 20th,https://financialpost.com/globe-newswire/hong-kong-earns-two-entries-on-the-prestigious-worlds-50-best-restaurants-list-with-best-entry-at-20th,"TORONTO, June 10, 2024 (GLOBE NEWSWIRE) — The Hong Kong Tourism Board (HKTB) applauded the city’s outstanding culinary sector as two restaurants – Wing and The Chairman – were ranked highly in the prestigious list of The World’s 50 Best Restaurants 2024. The …",2024-06-10T14:34:58Z,Error: 403 Client Error: Forbidden for url: https://financialpost.com/globe-newswire/hong-kong-earns-two-entries-on-the-prestigious-worlds-50-best-restaurants-list-with-best-entry-at-20th
44,The Canadian Press,National Bank to buy Canadian Western Bank at $5 billion valuation,https://financialpost.com/pmn/business-pmn/national-bank-to-buy-canadian-western-bank-at-5-billion-valuation,MONTREAL — Canada’s banking sector is facing further consolidation as National Bank of Canada has reached an all-share deal to acquire Canadian Western Bank that values the lender at about $5 billion. The deal will see Quebec-focused National Bank expand its …,2024-06-11T22:25:08Z,Error: 403 Client Error: Forbidden for url: https://financialpost.com/pmn/business-pmn/national-bank-to-buy-canadian-western-bank-at-5-billion-valuation
45,Business Wire,"Gold Reserve Announces Submission of Credit Bid for CITGO Petroleum Corp. Parent Company, PDV Holdings, Inc.",https://financialpost.com/pmn/business-wire-news-releases-pmn/gold-reserve-announces-submission-of-credit-bid-for-citgo-petroleum-corp-parent-company-pdv-holdings-inc,"TORONTO — Gold Reserve Inc. (TSX.V: GRZ) (OTCQX: GDRZF) (“Gold Reserve” or the “Company”) is pleased to announce the submission of a credit bid (the “Bid“) for the common shares of PDV Holdings, Inc. (“PDVH”), the indirect parent company of CITGO Petroleum Co…",2024-06-11T21:45:00Z,Error: 403 Client Error: Forbidden for url: https://financialpost.com/pmn/business-wire-news-releases-pmn/gold-reserve-announces-submission-of-credit-bid-for-citgo-petroleum-corp-parent-company-pdv-holdings-inc
46,GlobeNewswire,Questor Announces New Vice President of Operations and Engineering and Director of Sales and Marketing,https://financialpost.com/globe-newswire/questor-announces-new-vice-president-of-operations-and-engineering-and-director-of-sales-and-marketing,"CALGARY, Alberta, June 11, 2024 (GLOBE NEWSWIRE) — Questor Technology Inc. (“Questor”, the “Company”), (TSX Venture Exchange: QST) is pleased to announce Mr. Quentin Kyliuk, has joined the company as Vice President of Operations and Engineering and Ms. Stepha…",2024-06-11T23:52:44Z,Error: 403 Client Error: Forbidden for url: https://financialpost.com/globe-newswire/questor-announces-new-vice-president-of-operations-and-engineering-and-director-of-sales-and-marketing
47,The Associated Press,Production starts at Senegal’s first offshore oil project,https://financialpost.com/pmn/business-pmn/production-starts-at-senegals-first-offshore-oil-project,"DAKAR, Senegal (AP) — Production has started at Senegal’s first offshore oil project, the Australian group Woodside Energy said Tuesday, as the country’s new government eyes higher profits from natural resources. “This is a historic day for Senegal and for Wo…",2024-06-11T13:45:57Z,Error: 403 Client Error: Forbidden for url: https://financialpost.com/pmn/business-pmn/production-starts-at-senegals-first-offshore-oil-project
48,GlobeNewswire,EXP to lead engineering services for transformative land rights project in Senegal,https://financialpost.com/globe-newswire/exp-to-lead-engineering-services-for-transformative-land-rights-project-in-senegal,"MONTREAL, June 11, 2024 (GLOBE NEWSWIRE) — EXP, a multidisciplinary engineering, architecture, design and consulting firm, has been selected by the Senegalese Government to leverage its international experience for Senegal’s Cadastre and Land Tenure Improveme…",2024-06-11T15:27:34Z,Error: 403 Client Error: Forbidden for url: https://financialpost.com/globe-newswire/exp-to-lead-engineering-services-for-transformative-land-rights-project-in-senegal
49,The Associated Press,"Federal watchdog investigates UAW president Shawn Fain, accuses union of being uncooperative",https://financialpost.com/pmn/business-pmn/federal-watchdog-investigates-uaw-president-shawn-fain-accuses-union-of-being-uncooperative,NEW YORK (AP) — United Auto Workers president Shawn Fain is under investigation by a court-appointed watchdog who has been working to stamp out corruption at the union in the wake of its stunning bribery and embezzlement scandal several years ago. The monitor…,2024-06-11T16:20:59Z,Error: 403 Client Error: Forbidden for url: https://financialpost.com/pmn/business-pmn/federal-watchdog-investigates-uaw-president-shawn-fain-accuses-union-of-being-uncooperative
50,GlobeNewswire,Secretary Vilsack Announces USDA and FFAR Innovation Challenge to Catalyze Agricultural Solutions,https://financialpost.com/globe-newswire/secretary-vilsack-announces-usda-and-ffar-innovation-challenge-to-catalyze-agricultural-solutions,"WASHINGTON, June 11, 2024 (GLOBE NEWSWIRE) — The U.S. Department of Agriculture (USDA) and the Foundation for Food & Agriculture Research (FFAR) today launched a global challenge to advance scientific research that will produce major breakthroughs for nutriti…",2024-06-11T19:17:30Z,Error: 403 Client Error: Forbidden for url: https://financialpost.com/globe-newswire/secretary-vilsack-announces-usda-and-ffar-innovation-challenge-to-catalyze-agricultural-solutions
51,GlobeNewswire,Koryx Copper Share Consolidation,https://financialpost.com/globe-newswire/koryx-copper-share-consolidation,"Not for distribution to U.S. news wire services or dissemination in the United States. VANCOUVER, British Columbia, June 11, 2024 (GLOBE NEWSWIRE) — Koryx Copper Inc. (“Koryx” or the “Company“) (TSX-V: KRY) further to the Company’s news release on May 22, 202…",2024-06-11T20:18:45Z,Error: 403 Client Error: Forbidden for url: https://financialpost.com/globe-newswire/koryx-copper-share-consolidation
52,Business Wire,The Cannabist Company Continues Virginia Expansion with the Opening of Cannabist Richmond,https://financialpost.com/pmn/business-wire-news-releases-pmn/the-cannabist-company-continues-virginia-expansion-with-the-opening-of-cannabist-richmond,"11th Dispensary in Virginia Expands Access to Quality Cannabis Products for Patients NEW YORK — The Cannabist Company Holdings Inc. (Cboe CA: CBST) (OTCQX: CBSTF) (FSE: 3LP) (“The Cannabist Company” or the “Company”), one of the most experienced cultivators, …",2024-06-11T20:13:37Z,Error: 403 Client Error: Forbidden for url: https://financialpost.com/pmn/business-wire-news-releases-pmn/the-cannabist-company-continues-virginia-expansion-with-the-opening-of-cannabist-richmond
53,GlobeNewswire,HydroGraph Announces Closing of Oversubscribed Private Placement,https://financialpost.com/globe-newswire/hydrograph-announces-closing-of-oversubscribed-private-placement,"Not for distribution to U.S. newswire services or dissemination in the United States.All dollar amounts are in Canadian dollars unless otherwise indicated‎. VANCOUVER, British Columbia, June 11, 2024 (GLOBE NEWSWIRE) — HydroGraph Clean Power Inc. (CSE: ‎HG) (…",2024-06-11T21:04:51Z,Error: 403 Client Error: Forbidden for url: https://financialpost.com/globe-newswire/hydrograph-announces-closing-of-oversubscribed-private-placement
54,GlobeNewswire,Algoma Steel Appoints Erin Oliver as Vice President – Health and Safety,https://financialpost.com/globe-newswire/algoma-steel-appoints-erin-oliver-as-vice-president-health-and-safety,"SAULT STE. MARIE, June 11, 2024 (GLOBE NEWSWIRE) — Algoma Steel Group Inc. (NASDAQ: ASTL; TSX: ASTL) (“Algoma”), a leading Canadian producer of hot and cold rolled steel sheet and plate products, announced today that it has appointed Erin Oliver in a newly cr…",2024-06-11T20:03:25Z,Error: 403 Client Error: Forbidden for url: https://financialpost.com/globe-newswire/algoma-steel-appoints-erin-oliver-as-vice-president-health-and-safety
55,GlobeNewswire,OrbitBeyond Inc is Excited to Announce a Partnership with Spin.Works,https://financialpost.com/globe-newswire/orbitbeyond-inc-is-excited-to-announce-a-partnership-with-spin-works,"EDISON, N.J., June 11, 2024 (GLOBE NEWSWIRE) — OrbitBeyond Inc., a lunar transportation, infrastructure, and exploration services company, is excited to announce a foray into the development of a set of multi-purpose vehicles, in partnership with Spin.Works, …",2024-06-11T20:54:26Z,Error: 403 Client Error: Forbidden for url: https://financialpost.com/globe-newswire/orbitbeyond-inc-is-excited-to-announce-a-partnership-with-spin-works
56,Bloomberg News,Bank of France Cuts Growth Outlook as Budget Cuts Seen Biting,https://financialpost.com/pmn/business-pmn/bank-of-france-cuts-growth-outlook-as-budget-cuts-seen-biting,The Bank of France cut its growth forecasts for the next two years as it included higher assumptions for energy prices and a hit to activity from spending cuts to close down the budget deficit.,2024-06-11T18:18:58Z,Error: 403 Client Error: Forbidden for url: https://financialpost.com/pmn/business-pmn/bank-of-france-cuts-growth-outlook-as-budget-cuts-seen-biting
57,Howard Levitt,Howard Levitt: Rise in maternity related terminations exposes vulnerability of pregnant workers,https://financialpost.com/fp-work/maternity-terminations-vulnerability-pregnant-workers,The rise in maternity-related terminations highlights the need for stronger legal protections of pregnant workers. Read more.,2024-06-11T19:17:40Z,Error: 403 Client Error: Forbidden for url: https://financialpost.com/fp-work/maternity-terminations-vulnerability-pregnant-workers
58,GlobeNewswire,KP Tissue Inc. Reports on Shareholders’ Voting Results for the Election of Directors,https://financialpost.com/globe-newswire/kp-tissue-inc-reports-on-shareholders-voting-results-for-the-election-of-directors-4,"NOT FOR DISTRIBUTION IN THE U.S.A. OR OVER U.S. WIRE SERVICES MISSISSAUGA, Ontario, June 11, 2024 (GLOBE NEWSWIRE) — KP Tissue Inc. (“KPT”) (TSX: KPT) held its Annual Meeting of shareholders today. All candidates proposed as directors were duly elected to the…",2024-06-11T23:01:50Z,Error: 403 Client Error: Forbidden for url: https://financialpost.com/globe-newswire/kp-tissue-inc-reports-on-shareholders-voting-results-for-the-election-of-directors-4
59,The Associated Press,Paramount Global owner calls off merger talks with Skydance Media,https://financialpost.com/pmn/business-pmn/paramount-global-owner-calls-off-merger-talks-with-skydance-media,"NEW YORK (AP) — National Amusements, which owns a majority voting stake in embattled entertainment giant Paramount Global, said Tuesday that it has ended talks on a possible merger of Paramount with movie production company Skydance Media. The potential deal …",2024-06-12T00:38:53Z,Error: 403 Client Error: Forbidden for url: https://financialpost.com/pmn/business-pmn/paramount-global-owner-calls-off-merger-talks-with-skydance-media
60,Bloomberg News,Oil Holds Gain as Industry Report Points to Lower US Stockpiles,https://financialpost.com/pmn/business-pmn/oil-holds-gain-as-industry-report-points-to-lower-us-stockpiles,Oil held a two-day gain after industry data pointed to shrinking US crude stockpiles ahead of a report from the IEA on the market outlook.,2024-06-12T01:33:58Z,Error: 403 Client Error: Forbidden for url: https://financialpost.com/pmn/business-pmn/oil-holds-gain-as-industry-report-points-to-lower-us-stockpiles
61,GlobeNewswire,CapLinked Defies Economic Trends with Sustained Revenue and Client Growth,https://financialpost.com/globe-newswire/caplinked-defies-economic-trends-with-sustained-revenue-and-client-growth,"LOS ANGELES, June 11, 2024 (GLOBE NEWSWIRE) — CapLinked, Inc., a leading provider of cloud-based virtual data room software, today announced that it has continued to experience significant growth in revenues, client base, and international presence, even amid…",2024-06-11T18:05:45Z,Error: 403 Client Error: Forbidden for url: https://financialpost.com/globe-newswire/caplinked-defies-economic-trends-with-sustained-revenue-and-client-growth
62,Bloomberg News,"SSE, Vattenfall Win in Netherlands Largest Offshore Wind Tender",https://financialpost.com/pmn/business-pmn/sse-vattenfall-win-in-netherlands-largest-offshore-wind-tender,The largest-ever tender for offshore wind in the Netherlands has concluded with major players set to develop the sites even as the global industry faces challenges.,2024-06-11T18:54:30Z,Error: 403 Client Error: Forbidden for url: https://financialpost.com/pmn/business-pmn/sse-vattenfall-win-in-netherlands-largest-offshore-wind-tender
63,GlobeNewswire,Copenhagen Infrastructure Partners Announces Greengate Biogas Partnership in Ireland,https://financialpost.com/globe-newswire/copenhagen-infrastructure-partners-announces-greengate-biogas-partnership-in-ireland,"Copenhagen Infrastructure Partners (CIP), through its CI Advanced Bioenergy Fund I (CI ABF I), today announced the launch of Greengate Biogas in partnership with Atlas Renewables and Energex Partners. COPENHAGEN, Denmark and DUBLIN, June 12, 2024 (GLOBE NEWSW…",2024-06-12T08:31:57Z,Error: 403 Client Error: Forbidden for url: https://financialpost.com/globe-newswire/copenhagen-infrastructure-partners-announces-greengate-biogas-partnership-in-ireland
64,Business Wire,H2SITE Builds the Most Efficient Ammonia Cracker to Produce Fuel-Cell Purity Hydrogen for the Ammogen Project in the UK,https://financialpost.com/pmn/business-wire-news-releases-pmn/h2site-builds-the-most-efficient-ammonia-cracker-to-produce-fuel-cell-purity-hydrogen-for-the-ammogen-project-in-the-uk,"Located in Tyseley Energy Park (Birmingham, UK), the Ammogen project stands as the most efficient ammonia conversion to fuel-cell purity hydrogen. H2SITE has designed and constructed the most efficient cracker utilizing membrane reactor technology to provide …",2024-06-12T08:44:05Z,Error: 403 Client Error: Forbidden for url: https://financialpost.com/pmn/business-wire-news-releases-pmn/h2site-builds-the-most-efficient-ammonia-cracker-to-produce-fuel-cell-purity-hydrogen-for-the-ammogen-project-in-the-uk
65,GlobeNewswire,"Evergold Closes $1,072,000 Private Placement to Support Follow-up Drilling at Emerging DEM1 Gold-Silver++ Discovery, BC",https://financialpost.com/globe-newswire/evergold-closes-1072000-private-placement-to-support-follow-up-drilling-at-emerging-dem1-gold-silver-discovery-bc,"NOT FOR DISTRIBUTION TO UNITED STATES NEWS WIRE SERVICES OR FOR DISSEMINATION IN THE UNITED STATES TORONTO, June 12, 2024 (GLOBE NEWSWIRE) — Evergold Corp. (TSX-V: EVER, WKN: A2PTHZ) (“Evergold” or the “Company”) is pleased to report that it has closed a firs…",2024-06-12T11:05:07Z,Error: 403 Client Error: Forbidden for url: https://financialpost.com/globe-newswire/evergold-closes-1072000-private-placement-to-support-follow-up-drilling-at-emerging-dem1-gold-silver-discovery-bc
66,GlobeNewswire,Cielo Announces Binding Letter of Intent to Acquire Carseland Facility from Rocky Mountain Clean Fuels Inc. and Announces Termination of Agreements with Renewable U Energy Inc.,https://financialpost.com/globe-newswire/cielo-announces-binding-letter-of-intent-to-acquire-carseland-facility-from-rocky-mountain-clean-fuels-inc-and-announces-termination-of-agreements-with-renewable-u-energy-inc,"The acquisition of the Enhanced Gas to Liquids (“EGTL™”) facility located in Carseland, Alberta, is valued at $125 million Cielo intends to form a limited partnership (the “Cielo LP”) that will own the acquired EGTL™ facility. The facility will expand to proc…",2024-06-12T11:05:27Z,Error: 403 Client Error: Forbidden for url: https://financialpost.com/globe-newswire/cielo-announces-binding-letter-of-intent-to-acquire-carseland-facility-from-rocky-mountain-clean-fuels-inc-and-announces-termination-of-agreements-with-renewable-u-energy-inc
67,GlobeNewswire,"United Lithium Announces Drill Results for Lithium Pegmatites D & E Confirming Strike Length of over 4,000m at Bergby Project, Sweden",https://financialpost.com/globe-newswire/united-lithium-announces-drill-results-for-lithium-pegmatites-d-e-confirming-strike-length-of-over-4000m-at-bergby-project-sweden,"VANCOUVER, British Columbia, June 12, 2024 (GLOBE NEWSWIRE) — United Lithium Corp. (“United Lithium” or the “Company”) (CSE: ULTH; OTCQX: ULTHF; FWB: 0UL) is pleased to report additional assay results from the 2023 Drill Program on the newly discovered D and …",2024-06-12T11:05:22Z,Error: 403 Client Error: Forbidden for url: https://financialpost.com/globe-newswire/united-lithium-announces-drill-results-for-lithium-pegmatites-d-e-confirming-strike-length-of-over-4000m-at-bergby-project-sweden
68,Bloomberg News,Solar Installments Slow in South Africa After Blackouts Ease,https://financialpost.com/pmn/business-pmn/solar-installments-slow-in-south-africa-after-blackouts-ease,Repairs to South Africa’s coal-fired stations that have helped the state power utility avoid debilitating blackouts for three months straight is giving solar installers an unintended break.,2024-06-12T10:53:44Z,Error: 403 Client Error: Forbidden for url: https://financialpost.com/pmn/business-pmn/solar-installments-slow-in-south-africa-after-blackouts-ease
69,GlobeNewswire,Stallion Uranium Highlights Prospectivity of Intersected Conductive Structure at Appaloosa Target,https://financialpost.com/globe-newswire/stallion-uranium-highlights-prospectivity-of-intersected-conductive-structure-at-appaloosa-target,"VANCOUVER, British Columbia, June 12, 2024 (GLOBE NEWSWIRE) — Stallion Uranium Corp. (the “Company” or “Stallion”) (TSX-V: STUD; OTCQB: STLNF; FSE: FE0) is pleased to announce the significant advancements and interpretations from the maiden drill program comp…",2024-06-12T10:04:05Z,Error: 403 Client Error: Forbidden for url: https://financialpost.com/globe-newswire/stallion-uranium-highlights-prospectivity-of-intersected-conductive-structure-at-appaloosa-target
70,GlobeNewswire,"Solstice Commences Gold in Till Sampling Program at its Atikokan Project, Northwest Ontario",https://financialpost.com/globe-newswire/solstice-commences-gold-in-till-sampling-program-at-its-atikokan-project-northwest-ontario,"Program to Test Extensive Area of Gold Lake Sediment Anomalies VANCOUVER, British Columbia, June 12, 2024 (GLOBE NEWSWIRE) — Solstice Gold Corp. (TSXV: SGC) (“Solstice”, “we”, “our” or the “Company”) is pleased to announce the commencement of a focused gold i…",2024-06-12T10:03:51Z,Error: 403 Client Error: Forbidden for url: https://financialpost.com/globe-newswire/solstice-commences-gold-in-till-sampling-program-at-its-atikokan-project-northwest-ontario
71,Business Wire,"Schneider Electric Launches EcoFit™ in Canada, a Modern Approach to Handling Equipment Lifecycle",https://financialpost.com/pmn/business-wire-news-releases-pmn/schneider-electric-launches-ecofit-in-canada-a-modern-approach-to-handling-equipment-lifecycle,"EcoFit™ Spare Parts offers fast delivery 24/7 with quality assurance for emergency services and replacing critical spare parts. EcoFit™ solution is part of a full-value proposal across the circularity lifecycle of equipment, aiming to eliminate waste by up to…",2024-06-12T12:18:23Z,Error: 403 Client Error: Forbidden for url: https://financialpost.com/pmn/business-wire-news-releases-pmn/schneider-electric-launches-ecofit-in-canada-a-modern-approach-to-handling-equipment-lifecycle
72,Business Wire,ViewSonic Introduces New Ultra-Wide ViewBoard Interactive Display Solutions for Communication and Collaboration,https://financialpost.com/pmn/business-wire-news-releases-pmn/viewsonic-introduces-new-ultra-wide-viewboard-interactive-display-solutions-for-communication-and-collaboration,"The ViewBoard IFP92UW and IFP105UW are Designed to Perform with ViewSonic TeamOne and TeamJoin for Microsoft Teams Rooms BREA, Calif. — INFOCOMM 2024 Booth #W1215 – ViewSonic Corp., a leading global provider of visual and EdTech solutions, launches the latest…",2024-06-12T12:18:31Z,Error: 403 Client Error: Forbidden for url: https://financialpost.com/pmn/business-wire-news-releases-pmn/viewsonic-introduces-new-ultra-wide-viewboard-interactive-display-solutions-for-communication-and-collaboration
73,The Canadian Press,Dollarama plans Mexico expansion as it ups stake in Latin American business Dollarcity,https://financialpost.com/news/retail-marketing/dollarama-ups-stake-in-latin-american-business-dollarcity-plans-expansion-to-mexico,Dollarama Inc. has increased its stake in Latin American retailer Dollarcity to 60.1 per cent and announced a Mexico expansion. Read more.,2024-06-12T12:13:39Z,Error: 403 Client Error: Forbidden for url: https://financialpost.com/news/retail-marketing/dollarama-ups-stake-in-latin-american-business-dollarcity-plans-expansion-to-mexico
74,GlobeNewswire,Victory Square Company Hydreight Adds Another National Wellness Medspa Franchise Using Its White Label Solution,https://financialpost.com/globe-newswire/victory-square-company-hydreight-adds-another-national-wellness-medspa-franchise-using-its-white-label-solution,"Hydreight has secured National Medical Spa Partners with collectively almost 700 locations sold across the United States* VANCOUVER, British Columbia, June 12, 2024 (GLOBE NEWSWIRE) — Victory Square Technologies Inc. (“Victory Square” or the “Company”) (CSE:V…",2024-06-12T12:01:41Z,Error: 403 Client Error: Forbidden for url: https://financialpost.com/globe-newswire/victory-square-company-hydreight-adds-another-national-wellness-medspa-franchise-using-its-white-label-solution
75,Business Wire,Alphawave Semi to Showcase Next-Generation PCIe® 7.0 IP Platform for High-Performance Connectivity and Compute at PCI-SIG® DevCon 2024,https://financialpost.com/pmn/business-wire-news-releases-pmn/alphawave-semi-to-showcase-next-generation-pcie-7-0-ip-platform-for-high-performance-connectivity-and-compute-at-pci-sig-devcon-2024,"Participation at Santa Clara event includes industry leading demonstrations covering 128 Gbps PCIe 7.0 and PCI 6.0 specification interoperability over optics and copper cables LONDON & TORONTO — Alphawave Semi (LSE: AWE), a global leader in high-speed connect…",2024-06-12T12:18:14Z,Error: 403 Client Error: Forbidden for url: https://financialpost.com/pmn/business-wire-news-releases-pmn/alphawave-semi-to-showcase-next-generation-pcie-7-0-ip-platform-for-high-performance-connectivity-and-compute-at-pci-sig-devcon-2024
76,Bloomberg News,Canada Readies New Arctic Foreign Policy as Russia Threat Looms,https://financialpost.com/pmn/business-pmn/canada-readies-new-arctic-foreign-policy-as-russia-threat-looms,Canada is preparing a long-awaited Arctic strategy to respond to the growing threat posed by Russia and to strengthen security ties with northern NATO members.,2024-06-12T12:20:22Z,Error: 403 Client Error: Forbidden for url: https://financialpost.com/pmn/business-pmn/canada-readies-new-arctic-foreign-policy-as-russia-threat-looms
77,Business Wire,UbiSim Debuts New Initiative to Support Goals of the Nursing is STEM Coalition,https://financialpost.com/pmn/business-wire-news-releases-pmn/ubisim-debuts-new-initiative-to-support-goals-of-the-nursing-is-stem-coalition,"Campaign kicks off at INACSL 2024 Conference to require U.S. government agencies to categorize nursing as a STEM field to help alleviate nursing shortage BOSTON & MONTREAL — UbiSim ( www.ubisimvr.com), the world’s first immersive virtual reality platform buil…",2024-06-12T12:08:00Z,Error: 403 Client Error: Forbidden for url: https://financialpost.com/pmn/business-wire-news-releases-pmn/ubisim-debuts-new-initiative-to-support-goals-of-the-nursing-is-stem-coalition
