,author,title,url,description,date,content
29,Monique Lima,Secretário dos EUA vai ao Oriente Médio para pressionar pelo cessar-fogo em Gaza,https://www.infomoney.com.br/mundo/secretario-dos-eua-vai-ao-oriente-medio-para-pressionar-pelo-cessar-fogo-em-gaza/,"O principal diplomata dos EUA visitará Egito, Israel, Jordânia e Catar e se reunirá com seus líderes
The post Secretário dos EUA vai ao Oriente Médio para pressionar pelo cessar-fogo em Gaza appeared first on InfoMoney.",2024-06-07T20:02:33Z,"Publicidade O secretário de Estado dos EUA, Antony Blinken, viajará para o Oriente Médio na próxima semana, informou o Departamento de Estado dos EUA nesta sexta-feira (7), enquanto Washington tenta pressionar Israel e o Hamas a aceitarem uma proposta de cessar-fogo que o presidente norte-americano, Joe Biden, apresentou na semana passada. Em sua oitava visita à região desde que os militantes do Hamas atacaram Israel, em 7 de outubro, desencadeando o mais recente surto no conflito israelense-palestino de décadas, o principal diplomata dos EUA visitará Egito, Israel, Jordânia e Catar e se reunirá com seus líderes. A visita de Blinken ocorre depois que Biden apresentou um novo plano de cessar-fogo para encerrar a guerra de oito meses e em um momento em que as tensões entre Israel e o Hezbollah do Líbano aumentaram nos últimos dias, com ambos os lados sinalizando a disposição para um confronto maior. Continua depois da publicidade “O secretário discutirá como a proposta de cessar-fogo beneficiaria tanto os israelenses quanto os palestinos”, disse o Departamento de Estado em um comunicado. “Ele enfatizará que isso aliviaria o sofrimento em Gaza, possibilitaria um aumento maciço na assistência humanitária e permitiria que os palestinos retornassem aos seus bairros.” As conversações mediadas por Egito, Catar e outros para organizar um cessar-fogo entre Israel e o movimento militante Hamas na guerra de Gaza foram repetidamente paralisadas, com cada lado culpando o outro pela falta de progresso. O cessar-fogo, segundo o Departamento de Estado, também abriria a possibilidade de alcançar a calma ao longo da fronteira norte de Israel com o Líbano e estabeleceria condições para uma maior integração entre Israel e seus vizinhos árabes. Continua depois da publicidade “O secretário também continuará a reiterar a necessidade de evitar que o conflito se agrave ainda mais”, acrescentou. O primeiro-ministro israelense, Benjamin Netanyahu, disse na quarta-feira que Israel estava preparado para uma ação forte no norte. Ele advertiu em dezembro que Beirute seria transformada “em Gaza” se o Hezbollah iniciasse uma guerra total. A guerra entre Israel e o Hamas começou quando combatentes palestinos liderados pelo Hamas atacaram o sul de Israel a partir de Gaza, matando mais de 1.200 pessoas e fazendo mais de 250 reféns, de acordo com os registros israelenses. Continua depois da publicidade A campanha aérea e terrestre de Israel em Gaza deixou o território em ruínas, levou à fome generalizada e matou mais de 36.000 pessoas, de acordo com as autoridades de saúde palestinas. Enquanto estiver na Jordânia, Blinken participará de uma conferência sobre a resposta humanitária a Gaza, informou o departamento."
30,Marcos Mortari,"Após críticas, Haddad vê “mal entendido” sobre MP das compensações e promete diálogo",https://www.infomoney.com.br/politica/apos-criticas-haddad-ve-mal-entendido-sobre-mp-das-compensacoes-e-promete-dialogo/,"Ministro diz ter conversado com representantes de diversos setores e garante que indústria e exportadoras não serão afetadas por mudanças
The post Após críticas, Haddad vê “mal entendido” sobre MP das compensações e promete diálogo appeared first on InfoMoney.",2024-06-07T21:23:07Z,"Publicidade De volta ao Brasil após uma semana de compromissos internacionais, o ministro da Fazenda, Fernando Haddad (PT), se deparou com reclamações de diversos setores econômicos e parlamentares direcionadas à medida provisória (MPV 1227/2024) editada pelo governo federal para compensar os efeitos da desoneração a 17 setores da economia e de municípios. Seja um dos primeiros a garantir ingressos para a NFL no Brasil com a XP. Pré-venda exclusiva com Cartão XP, aprovado em 24h! Nas últimas horas, Haddad disse ter conversado com representantes de diversos segmentos da economia para pedira calma e tentar explicar as mudanças e, em entrevista coletiva, afirmou haver “muito mal entendido” sobre o assunto. Aos jornalistas, o ministro garantiu que dois dos segmentos mais vocais contra as medidas − a indústria e as exportadoras − não serão afetados − avaliação oposta à dos empresários. Continua depois da publicidade “Já falei com vários setores… E é natural esse tipo de coisa. Ninguém que tenha um privilégio quer abrir mão dele. É natural, mas (…) nós temos que levar em conta o país. O cenário externo não é favorável, é um cenário externo conturbado. O que temos que fazer é tomar as medidas para proteger nossa casa. Se fora não está bem, dentro tem que ficar melhor”, afirmou. A MPV 1227/2024, editada na última terça-feira (4), prevê a limitação ao uso de créditos do PIS (Programa de Integração Social) e da Cofins (Contribuição para Financiamento da Seguridade Social) para o abatimento de outros tributos e a vedação ao ressarcimento em dinheiro do crédito presumido − iniciativas que podem gerar aumento de arrecadação de R$ 29,2 bilhões, segundo cálculos do Ministério da Fazenda. A ideia do governo é que as mudanças ajudem a compensar os efeitos não previstos na Lei Orçamentária Anual (LOA) de 2024 para a prorrogação da desoneração da folha de pagamentos para 17 setores da economia até 2027 e da redução de alíquota previdenciária paga por milhares de municípios − que, nas contas da equipe econômica, devem gerar uma renúncia fiscal de R$ 26,3 bilhões apenas neste ano. Continua depois da publicidade Empresários, no entanto, têm expressado preocupação com a gestão de caixa de seus negócios e o risco de acúmulo de créditos de difícil compensação − papéis “podres”, que não garantiriam reembolso. Eles alegam que as mudanças podem prejudicar o ambiente para novos investimentos, afetando a a atividade econômica, a geração de novos empregos e até encarecendo produtos. “Vamos com calma. Como tudo o que fizemos até aqui, à medida que explicamos e abrimos os números… A MP 1185 era a MP do fim do mundo também. Depois, a 1202 era a MP do fim do mundo. Depois, a MP do Carf era a MP do fim do mundo. Depois, fundos fechados e offshore eram também… Isso tudo tem muito de calor do momento. Isso vai se dissipando na medida em que as pessoas compreenderem”, disse Haddad. Aos jornalistas, o ministro insistiu na tecla de que a medida provisória vem no sentido de cumprir decisão do Supremo Tribunal Federal (STF), que, provocado pelo próprio governo do presidente Luiz Inácio Lula da Silva (PT), deu prazo de 60 dias para que Executivo e Legislativo construíssem uma solução de compensação para a renúncia fiscal gerada com as desonerações aos 17 setores econômicos e a diversos municípios. Continua depois da publicidade Segundo Haddad, em apenas 3 anos, os gastos tributários com PIS/Cofins atacados pela medida provisória saltaram de R$ 5 bilhões para R$ 22 bilhões. O texto encaminhado ao parlamento também determina que empresas que gozem de alguma situação tributária favorecida informem o benefício junto à Receita Federal em um formulário que será lançado nos próximos dias. “Precisamos saber o que está acontecendo, mas efetivamente tem alguma coisa muito errada acontecendo. E nós vamos sentar com os líderes, como sempre fizemos, em busca de uma compensação para a desoneração, que foi reafirmada pelo Congresso Nacional, e respeitando uma decisão do Supremo Tribunal Federal, já por unanimidade de votos, de que, sem a compensação, volta a ter vigência a liminar. Em 45 dias, vai prejudicar os 17 setores que negociaram conosco os termos da reoneração”, afirmou o ministro. “Estamos fazendo isso com muita tranquilidade, mas percebi muito mal entendido − em particular, da indústria – sobre esse tema. E aí há certa pressa em responder sem analisar junto à Receita Federal os propósitos da medida. Mas é uma medida saneadora que visa dar transparência para um gasto tributário”, prosseguiu. Continua depois da publicidade Questionado sobre a ausência de diálogo prévio com os parlamentares sobre as medidas, Haddad alegou que as medidas não produzem efeito de curto prazo e disse que o espaço para discussões começa neste momento. O ministro também apontou o prazo apertado, de 60 dias dado pelo STF para a aprovação de uma solução para a compensação fiscal às desonerações, como fator a acelerar o envio do texto. “Essa medida só foi tomada em virtude de uma decisão judicial que mandava recompor o Orçamento deste ano. Então, nós temos tempo para explorar possibilidades e abrir os números para os parlamentares”, disse. Durante a conversa com os jornalistas, Haddad disse que a Receita Federal vai continuar com o mapeamento de gastos tributários na busca pelo equilíbrio das contas públicas, meta estabelecida pela própria Lei de Diretrizes Orçamentárias (LDO) de 2024. Continua depois da publicidade “Temos que controlar despesa, por um lado, e recuperar a receita que foi perdida ao longo desse tempo. Durante 10 anos, tivemos uma perda de receita muito grande em virtude não de decisões soberanas do Congresso Nacional, mas de uma série de expedientes que foram incluídos na legislação que permitiram essa drenagem”, disse. “Se ainda fosse em proveito de quem mais precisa, mas não, foi em proveito dos ‘campeões nacionais’, gente que não precisa de subvenção do Estado. Nós temos que subvencionar quem precisa, e não o andar de cima das cadeias políticas. A política de campeão nacional tem que acabar em proveito de uma política de atenção ao micro e pequeno empresário, a quem ganha 2 salários mínimos e não paga Imposto de Renda, a quem precisa de uma transferência de renda”, prosseguiu. O termo “campeões nacionais” esteve na linha de frente da política econômica adotada nos primeiros governos de Lula e foi aprofundada na gestão de Dilma Rousseff (PT). Por meio desta estratégia, o governo concedida crédito direcionado a empresas consideradas competitivas e estratégicas em determinados segmentos da economia, para que elas liderassem um processo de desenvolvimento industrial do país."
31,Monique Lima,Putin diz que Rússia não precisa usar armas nucleares para vencer na Ucrânia,https://www.infomoney.com.br/mundo/putin-diz-que-russia-nao-precisa-usar-armas-nucleares-para-vencer-na-ucrania/,"O presidente da Rússia ainda pediu que as pessoas parassem de discutir o tópico nuclear
The post Putin diz que Rússia não precisa usar armas nucleares para vencer na Ucrânia appeared first on InfoMoney.",2024-06-07T19:38:58Z,"Publicidade O presidente russo, Vladimir Putin, disse nesta sexta-feira (7) que não é preciso usar armas nucleares para garantir a vitória da Rússia na Ucrânia, o sinal mais forte já dado pelo chefe do Kremlin de que não haverá um ataque nuclear. Putin, cujas forças vêm avançando no leste da Ucrânia nos últimos meses, disse que não via condições para o uso de tais armas e pediu que as pessoas parassem de discutir o tópico nuclear. No entanto, Putin, que lidera a maior potência nuclear do mundo, disse que não descartava mudanças na doutrina nuclear russa, que estabelece as condições sob as quais essas armas poderiam ser usadas. Continua depois da publicidade Ele também disse que, se necessário, a Rússia poderia testar uma arma nuclear, embora não visse necessidade de fazê-lo no momento. A declaração de Putin veio em resposta a uma pergunta de Sergei Karaganov, um influente analista russo, que perguntou se o presidente deveria apontar uma “pistola nuclear para a têmpora” do Ocidente em relação à Ucrânia. “O uso é possível em um caso excepcional – no caso de uma ameaça à soberania e à integridade territorial do país. Não creio que esse caso tenha ocorrido. Não há essa necessidade”, disse Putin no Fórum Econômico Internacional de São Petersburgo. Continua depois da publicidade “Mas essa doutrina é uma ferramenta viva e estamos observando cuidadosamente o que está acontecendo no mundo ao nosso redor e não excluímos a possibilidade de fazer algumas mudanças nessa doutrina. Isso também está relacionado aos testes de armas nucleares.” A doutrina nuclear russa publicada em 2020 estabelece as condições sob as quais um presidente russo consideraria o uso de uma arma nuclear: em termos gerais, como resposta a um ataque usando armas nucleares ou outras armas de destruição em massa, ou ao uso de armas convencionais contra a Rússia “quando a própria existência do Estado é colocada sob ameaça”. “Se necessário, realizaremos testes. Até o momento, também não há necessidade disso, já que nossos recursos de informação e informática nos permitem produzir tudo em sua forma atual.” Continua depois da publicidade No ano passado, Karaganov propôs um ataque nuclear limitado a um membro da Otan na Europa para forçar o Ocidente a recuar no conflito sobre a Ucrânia e, assim, evitar a Terceira Guerra Mundial. Na semana passada, o presidente dos Estados Unidos, Joe Biden, flexibilizou algumas restrições ao uso de armamentos norte-americanos pela Ucrânia dentro da Rússia, o que provocou alertas de Moscou sobre uma escalada potencialmente perigosa no conflito. Putin disse na quarta-feira que poderia colocar mísseis convencionais a uma distância de ataque dos Estados Unidos e de seus aliados europeus se eles permitissem que a Ucrânia atacasse mais dentro do território russo com armas ocidentais de longo alcance. Ele também disse que o Ocidente estava errado ao presumir que a Rússia nunca usaria armas nucleares."
32,Monique Lima,Free flow: governo abre consulta pública para novo modelo de pedágio,https://www.infomoney.com.br/consumo/free-flow-governo-abre-consulta-publica-para-novo-modelo-de-pedagio/,"As sugestões poderão ser apresentadas ao longo dos próximos 30 dias por qualquer cidadão
The post Free flow: governo abre consulta pública para novo modelo de pedágio appeared first on InfoMoney.",2024-06-07T21:08:04Z,"Publicidade O Ministério dos Transportes iniciou nesta sexta-feira (7) uma consulta pública para definir o texto final da resolução do Conselho Nacional de Trânsito (Contran) que dispõe sobre o novo sistema de pedágio eletrônico a ser implementado em todo o território nacional. O sistema de cobrança free flow possibilitará ao condutor pagar apenas pelo trecho percorrido. A ideia é possibilitar a cobrança da taxa, sem a necessidade de parada ou redução de velocidade dos veículos, dispensados o uso de praças de pedágio ou barreiras físicas. A minuta do texto está disponível no site do ministério, e as sugestões poderão ser apresentadas ao longo dos próximos 30 dias por qualquer cidadão. Posteriormente, elas serão avaliadas pela equipe técnica da Secretaria Nacional de Trânsito (Senatran). Continua depois da publicidade Segundo o ministério, a proposta apresentada na minuta foi elaborada a partir da experiência adquirida durante 15 meses na Rodovia Rio-Santos, no trecho da BR-101 entre Ubatuba (SP) e a cidade do Rio de Janeiro. “Os resultados mostraram que a tecnologia dá mais fluidez no trânsito, diminui a emissão de carbono e permite uma cobrança mais justa para os usuários”, informou, em nota, a pasta. De acordo com o secretário Nacional de Trânsito, Adrualdo Catão, atualmente a cobrança do pedágio independe da quilometragem percorrida. “Com a nova resolução, o condutor vai pagar só o que ele usou [percorreu]. Tem muitas pessoas que moram perto do pedágio, por exemplo, e vão ser muito beneficiadas”, explicou durante a cerimônia de apresentação da minuta de resolução. Continua depois da publicidade Na proposta apresentada, consta que as placas dos veículos serão reconhecidas por um sistema óptico de caracteres e que será concedido ao usuário o prazo máximo de 30 dias corridos, contados da data da passagem do veículo pelo pedágio eletrônico, para o pagamento da tarifa. Segundo o secretário-executivo do ministério, George Santoro, os dados dos usuários serão centralizados no aplicativo da Carteira Digital de Trânsito (CDT). “A passagem do motorista será registrada em sua carteira, para que posteriormente ele possa consultar um link de pagamento lá mesmo, evitando assim a multa”, explicou."
33,Fábio Matos,Rodoviária de Porto Alegre reabre para viagens intermunicipais,https://www.infomoney.com.br/politica/rodoviaria-de-porto-alegre-reabre-para-viagens-intermunicipais/,"A retomada dos serviços no endereço oficial atenderá 116 municípios do estado, com cerca de 90 horários diários; a partir de sábado (8), a rodoviária funcionará das 6h às 21h
The post Rodoviária de Porto Alegre reabre para viagens intermunicipais appeared fir…",2024-06-07T15:25:26Z,"Publicidade A Estação Rodoviária de Porto Alegre (RS), no centro histórico da capital gaúcha, voltou a realizar, nesta sexta-feira (7), as viagens de ônibus intermunicipais no Rio Grande do Sul, após os temporais que provocaram a cheia do lago Guaíba, em maio. Na quinta-feira (6), a prefeitura liberou o acesso em frente à rodoviária para embarque e desembarque nos ônibus, táxis e carros de aplicativos. Baixe uma lista de 11 ações de Small Caps que, na opinião dos especialistas, possuem potencial de crescimento para os próximos meses e anos Continua depois da publicidade A retomada dos serviços no endereço oficial atenderá 116 municípios do estado, com cerca de 90 horários diários. A partir de sábado (8), a rodoviária funcionará das 6h às 21h. Com o retorno, a empresa Veppo, concessionária da rodoviária, informou que as operações no endereço alternativo, o terminal Antônio de Carvalho, no bairro Agronomia, foram encerradas nesta sexta-feira. As passagens para viagens intermunicipais poderão ser adquiridas no site oficial da rodoviária ou pelo aplicativo da Veppo para smartphones. Continua depois da publicidade O acesso será pela entrada do pórtico dos táxis, no Largo Vespasiano Júlio Veppo, 70, no Centro Histórico da cidade. Os demais acessos seguirão fechados por questão de segurança. Os embarques e desembarques serão feitos pelos 18 boxes da área de desembarque intermunicipal, do número 55 ao 72. O espaço contará com área de espera e banheiros, além de local de venda de passagens. Como o fornecimento de energia elétrica ainda não foi totalmente restabelecido, as 70 lojas seguirão fechadas. Continua depois da publicidade  Foram cumpridos mandados de busca e apreensão na prefeitura de Cachoeirinha (RS); são investigados agentes públicos e fornecedores envolvidos nas contratações emergenciais A partir de 13 de junho, as viagens de ônibus interestaduais com chegada ou partida de Porto Alegre também voltarão para a estação rodoviária da cidade. Inicialmente, os ônibus interestaduais com destino a Santa Catarina, Paraná e Rio de Janeiro vão operar em 12 horários diários. Desde a inundação da área central de Porto Alegre pelas águas do Lago Guaíba, em maio, as linhas interestaduais têm saído extraordinariamente do terminal rodoviário do município de Osório, no litoral norte do estado. Os bilhetes poderão ser comprados pelos sites das empresas disponíveis na página oficial da rodoviária. Antes é necessário verificar a disponibilidade de trajeto e horários diretamente no site de cada viação. Continua depois da publicidade A empresa Veppo recomenda aos usuários que, preferencialmente, comprem as passagens online para reduzir a demanda pelo atendimento presencial e, consequentemente, diminuir o tempo de espera em filas. O serviço de envio de encomendas pelo terminal rodoviário de Porto Alegre está temporariamente suspenso e sem previsão de retorno. Para mais informações, neste momento de calamidade pública, a Estação Rodoviária de Porto Alegre centralizou os canais de contato no WhatsApp, número (51) 3210-0101, em funcionamento de 8h às 18h, e pelo site da rodoviária."
34,Monique Lima,Projeto que garante água gratuita em shows e eventos artísticos em SP avança na Alesp,https://www.infomoney.com.br/politica/projeto-que-garante-agua-gratuita-em-shows-e-eventos-artisticos-em-sp-avanca-na-alesp/,"A Lei Ana Benevides garante o acesso gratuito de garrafas de uso pessoal ou a distribuição de embalagens sem custos adicionais ao público
The post Projeto que garante água gratuita em shows e eventos artísticos em SP avança na Alesp appeared first on InfoMone…",2024-06-07T15:35:40Z,"Publicidade A Comissão de Constituição, Justiça e Redação (CCJR), da Assembleia Legislativa de São Paulo, aprovou na quinta-feira (6) o projeto de lei que cria a lei Ana Benevides no estado.  O PL, de autoria do deputado Enio Tatto (PT), garante o acesso gratuito de garrafas de uso pessoal ou a distribuição de embalagens sem custos adicionais ao público, em eventos artísticos, shows e festivais de música. A lei é uma homenagem a Ana Benevides, jovem de Mato Grosso do Sul, que faleceu aos 23 anos em decorrência de uma intensa desidratação enquanto participava de um show da artista internacional Taylor Swift, no Rio de Janeiro, em 17 de novembro de 2023. Continua depois da publicidade “A crise climática está provocando impactos diretos na saúde pública de maneira preocupante. O aumento extremo das temperaturas resulta em riscos elevados de insolação, desidratação e até mesmo mortes afetando, especialmente, idosos e crianças”, argumentou Tatto. Segundo o deputado, relator do projeto, várias cidades já têm legislação de obrigatoriedade de fornecimento de água em bares, restaurantes e casas noturnas. Ele também destacou que festivais de música já adotam o procedimento, instalando bebedouros em vários pontos, para consumo do público. “Em locais de maior concentração de pessoas, os riscos se ampliam e o acesso a líquidos para hidratação precisa ser incentivado a fim de evitar maiores impactos”, afirma."
35,Fábio Matos,Polícia Federal pedirá a Javier Milei extradição de foragidos do 8 de janeiro,https://www.infomoney.com.br/politica/policia-federal-pedira-a-javier-milei-extradicao-de-foragidos-do-8-de-janeiro/,"PF deflagrou nova fase da Operação Lesa Pátria, que visava ao cumprimento de 208 mandados de prisão; até o fim da noite de quinta-feira (6), 49 pessoas haviam sido detidas e outras 159 continuavam foragidas
The post Polícia Federal pedirá a Javier Milei extra…",2024-06-07T17:29:06Z,"Publicidade A Polícia Federal (PF) decidiu encaminhar ao governo da Argentina, comandado pelo presidente Javier Milei, uma lista com pedidos de extradição de envolvidos nos ataques às sedes dos Poderes Executivo, Legislativo e Judiciário do Brasil no dia 8 de janeiro de 2023. Na quinta-feira (6), a corporação deflagrou uma nova fase da Operação Lesa Pátria, que visava ao cumprimento de 208 mandados de prisão preventiva – todos expedidos pelo Supremo Tribunal Federal (STF). As ações policiais ocorreram em 18 estados e no Distrito Federal. Baixe uma lista de 11 ações de Small Caps que, na opinião dos especialistas, possuem potencial de crescimento para os próximos meses e anos Continua depois da publicidade Segundo a PF, os investigados descumpriram medidas cautelares judiciais ou fugiram para outros países com o objetivo “de se furtarem da aplicação da lei penal”. Ainda de acordo com os investigadores, a principal rota de fuga é a Argentina. Até o fim da noite de quinta-feira, 49 pessoas haviam sido presas na operação. Outras 159 continuavam foragidas. Leia também: Continua depois da publicidade “Vamos listar todos os condenados que possivelmente estejam na Argentina e encaminhar os pedidos de extradição, tudo em articulação com o Ministério de Relações Exteriores e Supremo Tribunal Federal”, informou o diretor-geral da PF, Andrei Passos Rodrigues, em entrevista ao blog do jornalista Valdo Cruz, no G1. Segundo Andrei Rodrigues, a PF pedirá, ainda, que os nomes de todos os foragidos sejam incluídos na rede Anfast de capturas da Ameripol – a comunidade de polícias das Américas. Uma estimativa inicial aponta que 65 envolvidos nos ataques de 8 de janeiro teriam ido para a Argentina. A dúvida das autoridades brasileiras é como esse pedido de extradição será recebido pelo presidente da Argentina, Javier Milei, um dos principais aliados internacionais do ex-presidente Jair Bolsonaro (PL) – maior liderança de oposição ao atual governo brasileiro. Continua depois da publicidade No dia 8 de janeiro de 2023, uma semana após a posse do presidente Luiz Inácio Lula da Silva (PT), simpatizantes e apoiadores de Bolsonaro invadiram e depredaram as sedes dos Três Poderes, em Brasília (DF): o Supremo Tribunal Federal (STF), o Palácio do Planalto e o Congresso Nacional. Os crimes investigados pela PF são os seguintes:"
