,author,title,url,description,date,content
78,GlobeNewswire,ARHT Achieves World’s First Simultaneous Live Hologram Event from Four Different Cities,https://financialpost.com/globe-newswire/arht-achieves-worlds-first-simultaneous-live-hologram-event-from-four-different-cities,"TORONTO, June 12, 2024 (GLOBE NEWSWIRE) — ARHT Media Inc. (“ARHT” or “the Company”) (TSXV: ART), (OTCQB: ARHTF), the global leader in the development, production, and distribution of high-quality, low latency hologram and digital content, is proud to announce…",2024-06-12T12:31:47Z,Error: 403 Client Error: Forbidden for url: https://financialpost.com/globe-newswire/arht-achieves-worlds-first-simultaneous-live-hologram-event-from-four-different-cities
79,The Associated Press,Traffic resumes through Baltimore’s busy port after $100M cleanup of collapsed bridge,https://financialpost.com/pmn/business-pmn/traffic-resumes-through-baltimores-busy-port-after-100m-cleanup-of-collapsed-bridge,BALTIMORE (AP) — Authorities anticipate commercial shipping traffic through the Port of Baltimore will soon return to normal levels since the channel fully reopened earlier this week for the first time since the Francis Scott Key Bridge collapse. “They are ba…,2024-06-12T09:50:55Z,Error: 403 Client Error: Forbidden for url: https://financialpost.com/pmn/business-pmn/traffic-resumes-through-baltimores-busy-port-after-100m-cleanup-of-collapsed-bridge
80,Ben Cousins,"Bank CEOs want AI ASAP, but workplace resistance persists: IBM survey",https://financialpost.com/fp-work/bank-ceos-ai-workplace-resistance-ibm,"Bank CEOs are keen to implement generative AI into their daily operations, but are being met with resistance from the workforce. Read more.",2024-06-12T10:00:03Z,Error: 403 Client Error: Forbidden for url: https://financialpost.com/fp-work/bank-ceos-ai-workplace-resistance-ibm
81,The Associated Press,Stock market today: Asian shares are mixed ahead of a Fed decision on interest rates,https://financialpost.com/pmn/business-pmn/stock-market-today-asian-shares-are-mixed-ahead-of-a-fed-decision-on-interest-rates,"BANGKOK (AP) — Shares were mixed Wednesday in Asia ahead of a decision by the Federal Reserve on interest rates. In Japan, higher inflation and falling wages raised questions about how the central bank can navigate away from near-zero interest rates. The Bank…",2024-06-12T08:00:34Z,Error: 403 Client Error: Forbidden for url: https://financialpost.com/pmn/business-pmn/stock-market-today-asian-shares-are-mixed-ahead-of-a-fed-decision-on-interest-rates
82,Bloomberg News,Modi’s Key Ally-Linked Stocks Are Surprise Winners in India,https://financialpost.com/pmn/business-pmn/modis-key-ally-linked-stocks-are-surprise-winners-in-india,A bunch of companies based in India’s southern state of Andhra Pradesh have rallied hard this month after a politician from the region backed Prime Minister Narendra Modi to form a government.,2024-06-12T08:10:47Z,Error: 403 Client Error: Forbidden for url: https://financialpost.com/pmn/business-pmn/modis-key-ally-linked-stocks-are-surprise-winners-in-india
83,Bloomberg News,Labour Risks Surprising Private Equity With Tough Tax Message,https://financialpost.com/pmn/business-pmn/labour-risks-surprising-private-equity-with-tough-tax-message,"Attendees at private equity’s glitzy conference in Berlin last week said they were hopeful that Labour’s plans to raise their UK taxes would be modest. But, as the party’s manifesto is about to be released, the industry is at risk of being in for a nasty surp…",2024-06-12T09:01:48Z,Error: 403 Client Error: Forbidden for url: https://financialpost.com/pmn/business-pmn/labour-risks-surprising-private-equity-with-tough-tax-message
84,The Associated Press,Myanmar’s economy in crisis as civil strife disrupts trade and livelihoods,https://financialpost.com/pmn/business-pmn/myanmars-economy-in-crisis-as-civil-strife-disrupts-trade-and-livelihoods,"BANGKOK (AP) — Myanmar, once a thriving emerging economy, is struggling to regain momentum as the country’s civil war increasingly disrupts trade and livelihoods. World Bank economists estimate the country’s economy grew at a 1% annual pace in the year that e…",2024-06-12T09:05:03Z,Error: 403 Client Error: Forbidden for url: https://financialpost.com/pmn/business-pmn/myanmars-economy-in-crisis-as-civil-strife-disrupts-trade-and-livelihoods
85,GlobeNewswire,Orezone Intersects 113.74 g/t Gold Over 8.00m in Ongoing Exploration and Provides Project Update,https://financialpost.com/globe-newswire/orezone-intersects-113-74-g-t-gold-over-8-00m-in-ongoing-exploration-and-provides-project-update,"VANCOUVER, British Columbia, June 12, 2024 (GLOBE NEWSWIRE) — Orezone Gold Corporation (TSX: ORE, OTCQX: ORZCF) (the “Company” or “Orezone”) is pleased to provide drill results from its Bomboré Gold Mine located in central Burkina Faso. The results are from O…",2024-06-12T11:30:36Z,Error: 403 Client Error: Forbidden for url: https://financialpost.com/globe-newswire/orezone-intersects-113-74-g-t-gold-over-8-00m-in-ongoing-exploration-and-provides-project-update
86,The Associated Press,‘Bad Boys: Ride or Die’ boosts Will Smith’s comeback and the box office with $56 million opening,https://financialpost.com/pmn/business-pmn/bad-boys-ride-or-die-boosts-will-smiths-comeback-and-the-box-office-with-56-million-opening,"NEW YORK (AP) — “Bad Boys: Ride or Die,” the fourth installment in the Will Smith-Martin Lawrence action comedy series, opened with an estimated $56 million in theaters over the weekend, handing Hollywood a much-needed summer hit and Smith his biggest success…",2024-06-09T16:37:51Z,Error: 403 Client Error: Forbidden for url: https://financialpost.com/pmn/business-pmn/bad-boys-ride-or-die-boosts-will-smiths-comeback-and-the-box-office-with-56-million-opening
87,Bloomberg News,"Bulgarian Ex-Premier Borissov Wins Snap Vote, Exit Poll Says",https://financialpost.com/pmn/business-pmn/bulgarian-ex-premier-borissov-wins-snap-vote-exit-poll-says,"Bulgaria’s powerful former prime minister Boyko Borissov is on course to win the country’s sixth election in just over three years, but will fall short of a majority needed to end a political deadlock.",2024-06-09T17:29:01Z,Error: 403 Client Error: Forbidden for url: https://financialpost.com/pmn/business-pmn/bulgarian-ex-premier-borissov-wins-snap-vote-exit-poll-says
88,Bloomberg News,"Capital Gains Tax Hike a Start But Canada Needs More Revenue, IMF Says",https://financialpost.com/pmn/business-pmn/capital-gains-tax-hike-a-start-but-canada-needs-more-revenue-imf-says,"The International Monetary Fund says Prime Minister Justin Trudeau’s capital gains tax hike improves the system’s neutrality and won’t significantly harm investment or productivity growth, but his government must do more to boost revenue and tighten fiscal po…",2024-06-11T14:24:44Z,Error: 403 Client Error: Forbidden for url: https://financialpost.com/pmn/business-pmn/capital-gains-tax-hike-a-start-but-canada-needs-more-revenue-imf-says
89,Bloomberg News,EU Seeks to Speed Clean Energy Shift and Curb Russian LNG,https://financialpost.com/pmn/business-pmn/eu-seeks-to-speed-clean-energy-shift-and-curb-russian-lng,"The European Union’s executive will begin a push to strengthen its energy security and accelerate the shift away from fossil fuel imports, while wrestling with the tricky task of curbing supplies of Russian liquefied natural gas.",2024-06-11T17:07:41Z,Error: 403 Client Error: Forbidden for url: https://financialpost.com/pmn/business-pmn/eu-seeks-to-speed-clean-energy-shift-and-curb-russian-lng
90,Business Wire,Pixelle Specialty Solutions Announces Significant New Funding,https://financialpost.com/pmn/business-wire-news-releases-pmn/pixelle-specialty-solutions-announces-significant-new-funding,"SPRING GROVE, Pa. — Pennsylvania-based Pixelle Specialty Solutions (“Pixelle or the “Company”), a leading provider of specialty papers, announced today that it has secured significant new financing, positioning the company with ample liquidity for continued f…",2024-06-11T15:15:18Z,Error: 403 Client Error: Forbidden for url: https://financialpost.com/pmn/business-wire-news-releases-pmn/pixelle-specialty-solutions-announces-significant-new-funding
91,Bloomberg News,Canada Shares More Information With India On Sikh Murder Case,https://financialpost.com/pmn/business-pmn/canada-shares-more-information-with-india-on-sikh-murder-case,"Canada and India have increased their security exchanges in recent months over the assassination of Hardeep Singh Nijjar, including visits to India by senior Canadian officials to share a robust set of evidence on the case, according to people with knowledge …",2024-06-11T15:15:46Z,Error: 403 Client Error: Forbidden for url: https://financialpost.com/pmn/business-pmn/canada-shares-more-information-with-india-on-sikh-murder-case
92,GlobeNewswire,HEALWELL AI to Acquire VeroSource Solutions and its Cloud-based Health Data Interoperability Platform to Help Large Enterprises Adopt AI-Powered Population Health Capabilities,https://financialpost.com/globe-newswire/healwell-ai-to-acquire-verosource-solutions-and-its-cloud-based-health-data-interoperability-platform-to-help-large-enterprises-adopt-ai-powered-population-health-capabilities,"HEALWELL enters into an agreement to acquire VeroSource Solutions Inc. and its end-to-end, customizable, cloud-based platform that enables patients, care providers and administrators to seamlessly access and interact with healthcare data. VeroSource currently…",2024-06-11T14:51:55Z,Error: 403 Client Error: Forbidden for url: https://financialpost.com/globe-newswire/healwell-ai-to-acquire-verosource-solutions-and-its-cloud-based-health-data-interoperability-platform-to-help-large-enterprises-adopt-ai-powered-population-health-capabilities
93,GlobeNewswire,Restaurants Canada to Unveil Report on Impacts of Employment Insurance on Small Business in Canada,https://financialpost.com/globe-newswire/restaurants-canada-to-unveil-report-on-impacts-of-employment-insurance-on-small-business-in-canada,"Ottawa, June 11, 2024 (GLOBE NEWSWIRE) — Restaurants Canada will be holding a press conference to reveal the details of a new report “On the Precipice – Help is Needed”, authored by Ian Lee, PhD, Associate Professor, Carleton University, on the impacts of Emp…",2024-06-11T14:51:51Z,Error: 403 Client Error: Forbidden for url: https://financialpost.com/globe-newswire/restaurants-canada-to-unveil-report-on-impacts-of-employment-insurance-on-small-business-in-canada
94,The Canadian Press,"Bell closes deal to buy Outfront Media’s Canadian business, must sell 669 ad spaces",https://financialpost.com/pmn/business-pmn/bell-closes-deal-to-buy-outfront-medias-canadian-business-must-sell-669-ad-spaces,The Competition Bureau says Bell Media must sell nearly 700 advertising displays in Ontario and Quebec as a condition of its $410-million acquisition of outdoor advertising company Outfront Media Inc.’s Canadian operations. The watchdog’s ruling Monday comes …,2024-06-11T14:45:56Z,Error: 403 Client Error: Forbidden for url: https://financialpost.com/pmn/business-pmn/bell-closes-deal-to-buy-outfront-medias-canadian-business-must-sell-669-ad-spaces
95,GlobeNewswire,Pender Growth Fund Portfolio Company Announces Proposed Transaction,https://financialpost.com/globe-newswire/pender-growth-fund-portfolio-company-announces-proposed-transaction,"VANCOUVER, British Columbia, June 11, 2024 (GLOBE NEWSWIRE) — (TSXV: PTF) Pender Growth Fund Inc. (the “Company” or “PTF”) today announces that one of its significant investees, Copperleaf Technologies Inc. (TSX:CPLF) (“Copperleaf”), has entered into a defini…",2024-06-11T14:36:31Z,Error: 403 Client Error: Forbidden for url: https://financialpost.com/globe-newswire/pender-growth-fund-portfolio-company-announces-proposed-transaction
96,Bloomberg News,"Capital gains tax hike a start but Canada needs more revenue, IMF says",https://financialpost.com/personal-finance/taxes/capital-gains-tax-hike-a-start-but-canada-needs-more-revenue-imf-says,The IMF said Ottawa's capital gains tax hike is a start but Ottawa must do more to boost revenue and tighten fiscal policy. Find out more.,2024-06-11T14:24:44Z,Error: 403 Client Error: Forbidden for url: https://financialpost.com/personal-finance/taxes/capital-gains-tax-hike-a-start-but-canada-needs-more-revenue-imf-says
97,GlobeNewswire,Copenhagen Infrastructure Partners and Vattenfall awarded IJmuiden Ver Beta offshore wind farm,https://financialpost.com/globe-newswire/copenhagen-infrastructure-partners-and-vattenfall-awarded-ijmuiden-ver-beta-offshore-wind-farm,"Zeevonk, a joint venture of Copenhagen Infrastructure Partners (CIP), through its Energy Transition Fund, and Vattenfall has been awarded a permit to build wind farm IJmuiden Ver Beta in the Netherlands. This 2 GW offshore wind project will include a 50MW flo…",2024-06-11T16:33:52Z,Error: 403 Client Error: Forbidden for url: https://financialpost.com/globe-newswire/copenhagen-infrastructure-partners-and-vattenfall-awarded-ijmuiden-ver-beta-offshore-wind-farm
98,The Canadian Press,"Competition Bureau obtains court orders in investigation into Loblaw, Sobeys",https://financialpost.com/news/retail-marketing/competition-bureau-court-order-loblaw-sobeys,The Competition Bureau has obtained court orders in its probe into Loblaws and Sobeys over alleged anti-competitive conduct. Read more,2024-06-11T16:39:58Z,Error: 403 Client Error: Forbidden for url: https://financialpost.com/news/retail-marketing/competition-bureau-court-order-loblaw-sobeys
99,The Associated Press,"Michigan couple, attorney announced as winners of $842.4 million Powerball jackpot",https://financialpost.com/pmn/business-pmn/michigan-couple-attorney-announced-as-winners-of-842-4-million-powerball-jackpot,"GRAND BLANC TOWNSHIP, Mich. (AP) — A mid-Michigan couple and a lawyer from the west side of the state were announced Tuesday as winners of an $842.4 million Powerball lottery jackpot from a ticket purchased on New Year’s Day. The Breakfast Club lottery club o…",2024-06-11T16:45:32Z,Error: 403 Client Error: Forbidden for url: https://financialpost.com/pmn/business-pmn/michigan-couple-attorney-announced-as-winners-of-842-4-million-powerball-jackpot
